指標名,スポーツ施設,,,,,
中央区,銀座５丁目,-,東京都中央区銀座5-6-12 みゆきビル B2F,35.670897,139.7635065,FEELCYCLE Ginza 5th(フィールサイクル 銀座フィフス)
中央区,銀座５丁目,-,東京都中央区銀座5-4-9 ニューギンザ5ビル 5F,35.671356,139.7628135,Luxool(ラグール)銀座
中央区,銀座５丁目,-,東京都中央区銀座5-4-7 銀座サワモトビル B2F,35.671662,139.7630205,スクリーン ヨガ
中央区,銀座４丁目,-,東京都中央区銀座4-9-5 銀昭ビル B1F,35.670627,139.767075,EXPA(エクスパ) 銀座店
中央区,銀座４丁目,-,東京都中央区銀座4-4-1 八光ビルB1F,35.672418,139.7651265,PLAYGROUND(プレイグラウンド) 銀座
中央区,銀座４丁目,-,東京都中央区銀座4-14-6 ウイント銀座8ヒル4F,35.669061,139.768785,RDC GYM(アールディーシージム)
中央区,銀座４丁目,-,東京都中央区銀座4丁目12-17,35.669538,139.7674935,アスリーダーズ銀座本店
中央区,銀座４丁目,-,東京都中央区銀座4-1 西銀座 B2F,35.67294,139.7633085,エクササイズコーチ 銀座店
中央区,銀座４丁目,-,東京都中央区銀座4-3-1 並木館銀座8F,35.672607,139.7647395,ミットネス 銀座店
中央区,銀座４丁目,-,東京都中央区銀座4-2-17 銀座111レジャービル 11-13F,35.672625,139.7639925,美健LABO フィットネス館
中央区,銀座３丁目,-,東京都中央区 銀座3-11-16 VORT銀座イースト3F,35.670798,139.768524,Shapes(シェイプス) 銀座店
中央区,銀座３丁目,-,東京都中央区銀座3-2-1 マロニエゲート銀座2 RF,35.673732,139.7651535,The 銀座 de フットサル マロニゲート銀座2屋上
中央区,銀座３丁目,-,東京都中央区銀座3丁目4-12 文祥堂銀座ビルB1・2F,35.672607,139.765428,ゴールドジム銀座中央
中央区,銀座３丁目,-,東京都中央区銀座3-9-2,35.671887,139.7681775,ヨガ教室ノア 銀座校
中央区,銀座２丁目,-,東京都中央区銀座2-9-13 GINZA-2ビル7F,35.672625,139.7681595,APFCLUB 銀座 (エーピーエフクラブ)
中央区,銀座２丁目,-,東京都中央区銀座2-8-12 ユニデン銀座ビル9.10階,35.672544,139.7677275,B-MONSTER GINZA STUDIO(ビーモンスター 銀座スタジオ)
中央区,銀座２丁目,-,東京都中央区銀座2-11-14 銀座SLCビル,35.672085,139.768668,FiNC Fit(フィンクフィット) 銀座店
中央区,銀座２丁目,-,東京都中央区銀座2-6-5 銀座トレシャス8F,35.673597,139.7672235,サーフフィットスタジオ
中央区,銀座２丁目,-,東京都中央区銀座2-11-8 デュープレックス銀座タワー2/11 5F.6F,35.672139,139.7689785,ライザップ 銀座店
中央区,銀座１丁目,-,東京都中央区銀座1-8-19 3F,35.674254,139.7686095,Face Lift Lesson(フェイス レフト レッスン) スタジオ
中央区,銀座１丁目,-,東京都中央区銀座1-6-2 山口興産銀座Aビル B1,35.674776,139.767876,jump one Ginza.1 (ジャンプワン 銀座)
中央区,銀座１丁目,-,東京都中央区銀座1丁目2-1,35.675208,139.76775,ゴールドジム銀座東京店
中央区,銀座１丁目,-,東京都中央区銀座1-2-2,35.675154,139.7679525,ワウディーTOKYO
千代田区,紀尾井町,赤坂,東京都千代田区紀尾井町1-2,35.679555,139.736916,SPA & FITNESS KIOI(スパ アンド フィットネス キオイ)
千代田区,紀尾井町,赤坂,東京都千代田区紀尾井町7-1,35.683362,139.73202,上智大学真田堀運動場
千代田区,岩本町１丁目,-,東京都千代田区岩本町1-6-3 岩本町163ビル 1F,35.691696,139.7769615,ANYTIME FITNESS(エニタイムフィットネス) 千代田岩本町店
新宿区,岩戸町,-,東京都新宿区岩戸町11,35.700984,139.736457,カーブス神楽坂
千代田区,丸の内３丁目,大丸有,東京都千代田区丸の内3丁目1-1,35.676972,139.761324,Bodies running+丸の内
千代田区,丸の内３丁目,大丸有,東京都千代田区丸の内3丁目2,35.677845,139.7613645,セントラルスポーツジム&ラン丸の内二重橋
千代田区,丸の内２丁目,大丸有,東京都千代田区丸の内2-6-1 Marunouchi BRICK SQUARE 4F,35.678763,139.763016,TIPNESS MARUNOUCHI STYLE(ティップネスマルノウチスタイル)
千代田区,丸の内１丁目,大丸有,東京都千代田区丸の内1-5-1 新丸の内ビルディング B1F,35.682714,139.764249,MARUNOUCHI Bike&Run(マルノウチ バイクアンドラン)
千代田区,丸の内１丁目,大丸有,東京都千代田区丸の内1-8-2 鉄鋼ビルディング南館5F,35.682813,139.7701395,THE JEXER TOKYO Annex(ジェクサートウキョウアネックス)
千代田区,外神田６丁目,-,東京都千代田区外神田6-14-8,35.703477,139.771521,ヨガ教室ノア 秋葉原校
千代田区,外神田２丁目,-,東京都千代田区外神田2-5-12 タカラビル1F,35.700219,139.7689695,エニタイムフィットネス 秋葉原店
港区,海岸３丁目,-,東京都港区海岸3-26-1,35.645238,139.7586285,フットサルポイント芝浦
港区,海岸３丁目,-,東京都港区海岸3丁目33-20,35.638155,139.758858,港区立芝浦南ふ頭公園運動広場
港区,海岸３丁目,-,東京都港区海岸3-33-20,35.638155,139.758858,芝浦南ふ頭公園運動広場(かいがんぱ-く)
港区,海岸１丁目,-,東京都港区海岸1-2-3 汐留芝離宮ビルディング 2F,35.65701,139.7585475,GOLD'S GYM(ゴールドジム) 浜松町東京
新宿区,霞ヶ丘町,-,東京都新宿区霞ヶ丘町11-1,35.680275,139.7148975,神宮外苑フットサルクラブ千駄ヶ谷コート
新宿区,霞ヶ丘町,-,東京都新宿区霞ヶ丘町2-4,35.675973,139.717935,神宮球場 室内球技場
港区,霞ヶ丘町,-,東京都新宿区霞ケ丘町・港区北青山,35.67501451,139.7132594,明治神宮外苑
新宿区,霞ヶ丘町,-,東京都新宿区霞ヶ丘町2-1,35.677413,139.717575,明治神宮外苑 打撃練習場
新宿区,歌舞伎町２丁目,-,東京都新宿区歌舞伎町2-44-1 東京都健康プラザ ハイジア5F,35.696628,139.700988,東急スポーツオアシス 新宿店
新宿区,歌舞伎町１丁目,-,東京都新宿区歌舞伎町1-1-17 エキニア新宿ビル5F,35.693145,139.7041875,RIZAP WOMAN(ライザップ ウーマン) 新宿店
新宿区,下落合４丁目,-,東京都新宿区下落合4丁目26-7,35.722053,139.6959255,ジョイフィット24目白
新宿区,下宮比町,-,東京都新宿区下宮比町2-1,35.702946,139.7437785,エニタイムフィットネスセンター飯田橋店
千代田区,猿楽町２丁目,-,東京都千代田区神田猿楽町2丁目8-8,35.700705,139.757958,エスフォルタ水道橋
渋谷区,猿楽町,-,東京都渋谷区猿楽町12-35,35.65107,139.7016765,猿楽トレーニングジム
渋谷区,猿楽町,-,東京都渋谷区猿楽町7-1,35.651871,139.702311,東京プロポーションラボ
渋谷区,円山町,-,東京都渋谷区円山町3-6 E・スペースタワー3F,35.657478,139.6955385,TOTAL Workout SHIBUYA (トータルワークアウト 渋谷)
新宿区,榎町,-,東京都新宿区榎町43-1 ユニゾ神楽坂ビル 1F,35.704539,139.7286405,ANYTIME FITNESS(エニタイムフィットネス) 神楽坂店
千代田区,永田町２丁目,赤坂,東京都千代田区永田町2丁目13-10,35.675658,139.73877,WOW’D赤坂店
千代田区,永田町２丁目,赤坂,東京都千代田区永田町2-13-10 プルデンシャルタワー2F,35.675658,139.73877,スポーツクラブNAS 赤坂店
渋谷区,宇田川町,-,東京都渋谷区宇田川町19-5-706,35.661438,139.6995615,CREBIQ(クレビック) 渋谷店
渋谷区,宇田川町,-,東京都渋谷区宇田川町23-3 渋谷第一勧銀共同ビル5F,35.6598,139.699593,CYCLE&STUDIO R Shibuya(サイクルスタジオアールシブヤ)
渋谷区,宇田川町,-,東京都渋谷区宇田川町20-11 渋谷三葉ビル 3F,35.660781,139.6998225,FEEL CYCLE(フィール サイクル) 渋谷
渋谷区,宇田川町,-,東京都渋谷区宇田川町15-1 SHIBUYA PARCO内,35.662032,139.698945,jump one(ジャンプ ワン)
渋谷区,宇田川町,-,東京都渋谷区宇田川町36-19,35.661843,139.696677,MITTNESS渋谷店
渋谷区,宇田川町,-,東京都渋谷区宇田川町33-8 塚田ビル6F,35.660898,139.696803,TARGET SHIBUYA
渋谷区,宇田川町,-,東京都渋谷区宇田川町3-10 いちごフィエスタ渋谷 7F,35.6625,139.69872,エクササイズコーチ 渋谷店
渋谷区,宇田川町,-,東京都渋谷区宇田川町16-4,35.661411,139.699215,ティップ.クロス TOKYO(トーキョー) 渋谷
千代田区,一ツ橋１丁目,-,東京都千代田区一ツ橋1-1-1 パレスサイドビル1F,35.691129,139.757211,Run Pit by au Smart Sports(ランピット バイ エーユー スマート スポーツ)
港区,愛宕１丁目,虎ノ門,東京都港区愛宕1丁目7-8,35.664201,139.749192,愛宕弓道場
