江東区,東雲１丁目,-,東京都江東区東雲1丁目9-11-102,35.645867,139.803642,のずえ小児科,小児科,https://byoinnavi.jp/clinic/2075
港区,虎ノ門１丁目,虎ノ門,東京都港区虎ノ門一丁目15-11 虎ノ門林ビル,35.668908,139.748688,高木歯科医院,"歯科, 矯正歯科, 歯科口腔外科",https://byoinnavi.jp/clinic/2428
港区,虎ノ門１丁目,虎ノ門,東京都港区虎ノ門一丁目8-14 三昭ビル2F,35.669291,139.750301,三昭歯科医院,"歯科, 小児歯科, 歯科口腔外科",https://byoinnavi.jp/clinic/2438
港区,高輪１丁目,-,東京都港区高輪一丁目26-10,35.637941,139.73356,鈴木歯科医院,歯科,https://byoinnavi.jp/clinic/2683
港区,六本木７丁目,六本木,東京都港区六本木7丁目18-5 ソフィア六本木1F,35.662113,139.728787,六本木歯科医院,"歯科, 小児歯科",https://byoinnavi.jp/clinic/3607
港区,虎ノ門１丁目,虎ノ門,東京都港区虎ノ門1丁目11-11 七久保ビル2階,35.668491,139.749929,宮川歯科医院,"歯科, 矯正歯科, 小児歯科, 歯科口腔外科",https://byoinnavi.jp/clinic/2490
港区,六本木３丁目,六本木,東京都港区六本木3丁目7-1 THE六本木東京207号,35.663963,139.734852,医療法人社団 六本木境クリニック,"形成外科, 美容外科",https://byoinnavi.jp/clinic/181840
港区,西新橋１丁目,虎ノ門,東京都港区西新橋一丁目5-9 TSビル3F,35.669147,139.753834,井上歯科医院,歯科,https://byoinnavi.jp/clinic/2508
港区,赤坂６丁目,赤坂,東京都港区赤坂6丁目4-20,35.670613,139.73478,児玉歯科医院,歯科,https://byoinnavi.jp/clinic/3461
港区,西新橋１丁目,虎ノ門,東京都港区西新橋1丁目20-10 サンライズ山西ビル2階,35.667747,139.75229,石川歯科医院,"歯科, 矯正歯科, 小児歯科",https://byoinnavi.jp/clinic/2466
港区,新橋２丁目,虎ノ門広域,東京都港区新橋2丁目10-5 末吉ビル2階,35.667041,139.755729,未来歯科,"歯科, 矯正歯科, 小児歯科",https://byoinnavi.jp/clinic/179359
港区,麻布十番２丁目,-,東京都港区麻布十番2丁目8-10 麻布松尾ビル3F,35.655403,139.734567,綱島歯科クリニック,歯科,https://byoinnavi.jp/clinic/3267
江東区,大島７丁目,-,東京都江東区大島七丁目38-30 ダイエー東大島3階,35.690863,139.842554,医療法人社団育芯会 ハートリーフ歯科クリニック東大島,"歯科, 小児歯科",https://byoinnavi.jp/clinic/267088
江東区,白河４丁目,-,東京都江東区白河4丁目9-12,35.682794,139.80872,いわたや歯科クリニック,"歯科, 矯正歯科, 小児歯科, 歯科口腔外科",https://byoinnavi.jp/clinic/261436
江東区,牡丹２丁目,-,東京都江東区牡丹2丁目10-1,35.670659,139.795187,門前仲町歯科・矯正歯科,"歯科, 矯正歯科, 小児歯科",https://byoinnavi.jp/clinic/270401
江東区,北砂６丁目,-,東京都江東区北砂6丁目19-27,35.684636,139.838435,北砂デンタルクリニック,"歯科, 矯正歯科, 小児歯科, 歯科口腔外科",https://byoinnavi.jp/clinic/8144
江東区,石島,-,東京都江東区石島4-6 石島ビル1F,35.680391,139.811353,江東プラス歯科・矯正歯科,"歯科, 矯正歯科, 歯科口腔外科, 小児歯科",https://byoinnavi.jp/clinic/264095
江東区,千石３丁目,-,東京都江東区千石3丁目1-36,35.678614,139.818382,医療法人社団瑞芳会 中村歯科医院,"歯科, 矯正歯科, 小児歯科, 歯科口腔外科",https://byoinnavi.jp/clinic/8000
江東区,大島５丁目,-,東京都江東区大島五丁目7-6 メゾン・ド・フロレゾン2階,35.68938,139.832805,医療法人社団栄耀会 青木歯科医院,"歯科, 矯正歯科, 小児歯科",https://byoinnavi.jp/clinic/7853
江東区,亀戸１丁目,-,東京都江東区亀戸1丁目29-12,35.694034,139.825089,小泉歯科医院,"歯科, 矯正歯科, 小児歯科",https://byoinnavi.jp/clinic/7791
江東区,住吉１丁目,-,東京都江東区住吉一丁目4-2 フレスポ住吉1階,35.688379,139.8111,医療法人社団藤美 住吉パール歯科クリニック,"歯科, 小児歯科",https://byoinnavi.jp/clinic/254368
江東区,東陽３丁目,-,東京都江東区東陽3-5-5 ラウクティビルディング4階,35.66912,139.81018,木場小児科,"小児科, アレルギー科",https://byoinnavi.jp/clinic/265111
江東区,北砂４丁目,-,東京都江東区北砂四丁目2-12 橋本ビル1F,35.679139,139.828042,医療法人社団創仁会 北砂小嶋歯科クリニック,"歯科, 矯正歯科, 小児歯科",https://byoinnavi.jp/clinic/8123
江東区,牡丹３丁目,-,東京都江東区牡丹3-6-3,35.669076,139.797615,医療法人社団良修会 原澤歯科,"歯科, 小児歯科",https://byoinnavi.jp/clinic/2051
江東区,亀戸４丁目,-,東京都江東区亀戸4-28-3 1F,35.704761,139.826156,すぎさき歯科医院,"歯科, 小児歯科, 矯正歯科, 歯科口腔外科",https://byoinnavi.jp/clinic/181906
江東区,東雲１丁目,-,東京都江東区東雲1丁目9-22 アパーツメンツ東雲キャナルコート1F,35.648242,139.802956,医療法人社団天白会 キャナルコートデンタルクリニック 東雲キャナルコート内クリニック,"歯科, 矯正歯科, 小児歯科",https://byoinnavi.jp/clinic/4130
江東区,木場５丁目,-,東京都江東区木場五丁目11-19 大阪屋ビル2F,35.669565,139.807944,須藤歯科医院,"歯科, 小児歯科",https://byoinnavi.jp/clinic/8073
江東区,北砂５丁目,-,東京都江東区北砂5丁目18-6,35.684222,139.835613,進藤歯科医院,歯科,https://byoinnavi.jp/clinic/8217
江東区,平野３丁目,-,東京都江東区平野3丁目2-13 ウェルネス木場公園1階,35.676636,139.805906,ウェルネス木場公園クリニック,"内科, 神経内科, リハビリテーション科",https://byoinnavi.jp/clinic/709
江東区,豊洲４丁目,-,東京都江東区豊洲4丁目7-1,35.65561,139.798462,豊洲医院,"内科(消化器・循環器・呼吸器), 皮膚科, アレルギー科",https://byoinnavi.jp/clinic/77753
江東区,北砂６丁目,-,東京都江東区北砂6丁目1-4,35.680431,139.835388,おおぞら太陽クリニック,"内科, 呼吸器科, 小児科",https://byoinnavi.jp/clinic/8135
江東区,北砂５丁目,-,東京都江東区北砂5丁目20番8号棟E区画,35.683477,139.83288,五味皮フ科,"皮膚科, アレルギー科",https://byoinnavi.jp/clinic/258647
江東区,南砂２丁目,-,東京都江東区南砂2丁目28-7,35.675411,139.822087,医療法人社団 川善会 六地蔵クリニック,"脳神経外科, 整形外科, 神経内科, 循環器科, リハビリテーション科",https://byoinnavi.jp/clinic/572
江東区,大島１丁目,-,東京都江東区大島1-1-5 メディカルポートクローバー橋2F,35.68583,139.821368,医療法人社団 駿圭美会 水谷皮フ科クリニック,"皮膚科, 美容皮膚科",https://byoinnavi.jp/clinic/274553
江東区,東陽３丁目,-,東京都江東区東陽3丁目8-5,35.670362,139.809294,永田医院,"内科, 循環器内科, 小児科",https://byoinnavi.jp/clinic/1551
江東区,大島２丁目,-,東京都江東区大島2-33-10 プラウドタワー亀戸1F,35.69262,139.825825,五の橋タワークリニック,"内科, 糖尿病内科, 消化器内科, 外科, 肛門外科",https://byoinnavi.jp/clinic/161581
江東区,千田,-,東京都江東区千田13-13,35.681844,139.815363,医療法人社団松晴会 森井整形外科,"リウマチ科, 整形外科, リハビリテーション科",https://byoinnavi.jp/clinic/811
江東区,海辺,-,東京都江東区海辺12-11,35.680813,139.818052,正井診療所,"内科, 循環器内科",https://byoinnavi.jp/clinic/7759
江東区,豊洲５丁目,-,東京都江東区豊洲5-6-3 パークホームズ豊洲ザレジデンス1F,35.650911,139.796623,豊洲小児科醫院,"小児科, アレルギー科, 小児皮膚科, 小児腎臓内科, 小児循環器内科",https://byoinnavi.jp/clinic/265214
江東区,亀戸６丁目,-,東京都江東区亀戸6-57-20 亀戸東口駅前ビル2F,35.697028,139.828905,亀戸水神森クリニック,"内科, 整形外科, 小児整形外科, 外科, 胃腸科, 肛門科, リハビリテーション科",https://byoinnavi.jp/clinic/1507
江東区,東陽３丁目,-,東京都江東区東陽三丁目27番32号 玉河ビル4階,35.669754,139.815121,東陽パークサイドクリニック,"消化器内科, 内科",https://byoinnavi.jp/clinic/255977
江東区,森下２丁目,-,東京都江東区森下2-28-3 森下TMマンション1F,35.689435,139.799208,もりした耳鼻咽喉科,耳鼻いんこう科,https://byoinnavi.jp/clinic/1471
江東区,大島５丁目,-,東京都江東区大島5丁目32-1 大島シャスターマンション1階,35.688907,139.835107,おおじま眼科,眼科,https://byoinnavi.jp/clinic/7832
江東区,豊洲２丁目,-,東京都江東区豊洲2-5-3-102E,35.658399,139.792107,豊洲パークシティ皮膚科,"皮膚科, アレルギー科, 美容皮膚科",https://byoinnavi.jp/clinic/1481
江東区,東雲１丁目,-,東京都江東区東雲1-9-22,35.648242,139.802956,たかすな内科・胃腸内科クリニック,"内科, 胃腸科, 消化器科, 内視鏡内科",https://byoinnavi.jp/clinic/119643
江東区,有明２丁目,-,東京都江東区有明2丁目1-8 有明ガーデン4階,35.638568,139.792846,一般社団法人Baby Health Care ベビースマイルレディースクリニック有明,産婦人科,https://byoinnavi.jp/clinic/275797
江東区,木場１丁目,-,東京都江東区木場1丁目5-30 イトーヨーカ堂木場店2F,35.666148,139.8042,きせん眼科,眼科,https://byoinnavi.jp/clinic/2083
江東区,千石２丁目,-,東京都江東区千石2丁目10-6 JU TOWERFRONT千石 1階,35.678181,139.817252,千石はやし内科クリニック,"内科, 消化器内科",https://byoinnavi.jp/clinic/278471
江東区,猿江２丁目,-,東京都江東区猿江2丁目16-5 住吉メディカルモール3F,35.685185,139.816396,医療法人社団慈江会 住吉内科消化器内科クリニック,"内科, 消化器内科, 内視鏡内科",https://byoinnavi.jp/clinic/251072
江東区,北砂４丁目,-,東京都江東区北砂4丁目6-2,35.677339,139.828103,医療法人社団 東柏会 亀高医院,"内科, 消化器内科, 内視鏡内科, 高齢者内科",https://byoinnavi.jp/clinic/77759
江東区,豊洲５丁目,-,東京都江東区豊洲5-6-29 パークホームズ豊洲 ザ レジデンス1F,35.651325,139.797065,きずときずあとのクリニック豊洲院,"形成外科, 美容外科, 皮膚科",https://byoinnavi.jp/clinic/266917
江東区,北砂２丁目,-,東京都江東区北砂2丁目1-22,35.678983,139.827111,医療法人財団寿康会 寿康会病院,"内科, 心療内科, 小児科, 外科, 整形外科, リハビリテーション科, 皮膚科, 呼吸器内科, 循環器内科",https://byoinnavi.jp/clinic/571
江東区,高橋,-,東京都江東区高橋13-2 ヴィラロイヤル森下1F,35.685702,139.798664,医療法人社団済世会 望月内科クリニック,"内科, 呼吸器科, 循環器科, アレルギー科",https://byoinnavi.jp/clinic/217
江東区,大島５丁目,-,東京都江東区大島5丁目32-5,35.68891,139.835852,いのうえ整形外科,"整形外科, リハビリテーション科",https://byoinnavi.jp/clinic/156964
江東区,森下１丁目,-,東京都江東区森下1丁目5-5 ロイヤルプラザ森下607号,35.686763,139.798031,イシハラクリニック,内科,https://byoinnavi.jp/clinic/2165
江東区,東砂５丁目,-,東京都江東区東砂5丁目3-4,35.675831,139.841188,葛西橋診療所,"内科, 循環器内科, 呼吸器内科",https://byoinnavi.jp/clinic/8195
江東区,豊洲２丁目,-,東京都江東区豊洲2丁目5-3 パークシティ豊洲C棟1階 医療モール,35.658399,139.792107,医療法人社団公雄会 豊洲寺沢クリニック,"内科, 循環器科",https://byoinnavi.jp/clinic/1952
江東区,有明２丁目,-,東京都江東区有明2丁目1-7 有明ガーデンモール&スパ1F,35.638273,139.791599,医療法人社団天白会 有明ガーデン歯科クリニック,"歯科, 矯正歯科, 小児歯科, 歯科口腔外科",https://byoinnavi.jp/clinic/278567
江東区,南砂２丁目,-,東京都江東区南砂2丁目1-9 ジェイスクエア東陽町2階,35.669432,139.820804,OHANA DENTAL OFFICE,"歯科, 矯正歯科, 小児歯科, 歯科口腔外科",https://byoinnavi.jp/clinic/8116
江東区,東陽６丁目,-,東京都江東区東陽6丁目3-2 イースト21タワー206,35.674373,139.815557,医療法人社団池田会 イースト21デンタルオフィス,"歯科, 矯正歯科, 小児歯科",https://byoinnavi.jp/clinic/7999
江東区,有明３丁目,-,東京都江東区有明3丁目7-18 有明セントラルタワー2F,35.632058,139.793702,医療法人社団清慈会 有明パーク歯科クリニック,"歯科, 小児歯科, 歯科口腔外科",https://byoinnavi.jp/clinic/254370
江東区,豊洲４丁目,-,東京都江東区豊洲4丁目4-23 クロスシー豊洲ビル1階,35.653752,139.798498,左近歯科医院,"歯科, 矯正歯科, 小児歯科, 歯科口腔外科",https://byoinnavi.jp/clinic/281286
江東区,大島３丁目,-,東京都江東区大島三丁目3-3 サミービルディング1F,35.69166,139.826386,医療法人社団明敬会 タキザワ歯科クリニック,"歯科, 矯正歯科, 小児歯科, 歯科口腔外科",https://byoinnavi.jp/clinic/7773
江東区,豊洲２丁目,-,東京都江東区豊洲2-5-3 パークシティ豊洲コートC棟1F,35.658399,139.792107,けいこ豊洲こどもクリニック,"小児科, アレルギー科",https://byoinnavi.jp/clinic/276515
江東区,牡丹１丁目,-,東京都江東区牡丹1丁目14-2,35.670981,139.793773,ロータス歯科医院,"歯科, 矯正歯科, 小児歯科, 歯科口腔外科",https://byoinnavi.jp/clinic/255279
江東区,大島３丁目,-,東京都江東区大島3-4-3 タワーレジデンス西大島2F,35.692115,139.8266,西大島駅と亀戸駅の間のいわぶち内科と泌尿器科のクリニック,"泌尿器科, 女性・泌尿器科, 小児・泌尿器科, 内科",https://byoinnavi.jp/clinic/265179
江東区,豊洲４丁目,-,東京都江東区豊洲4丁目9-13 東京フロントコート1F,35.655866,139.800886,とよす整形外科・耳鼻咽喉科,"整形外科, 耳鼻いんこう科, リハビリテーション科",https://byoinnavi.jp/clinic/704
江東区,大島６丁目,-,東京都江東区大島6丁目21-8,35.693721,139.837176,さとう歯科クリニック,"歯科, 矯正歯科, 小児歯科, 歯科口腔外科",https://byoinnavi.jp/clinic/7850
江東区,東雲１丁目,-,東京都江東区東雲1丁目9-10 イオン東雲ショッピングセンター2F,35.64912,139.802345,いよりこどもクリニック,小児科,https://byoinnavi.jp/clinic/2072
江東区,東陽４丁目,-,東京都江東区東陽4-10-8 杉船ビル 6階,35.67194,139.816532,東陽町はぐくみファミリークリニック,"小児科, アレルギー科",https://byoinnavi.jp/clinic/280832
江東区,牡丹３丁目,-,東京都江東区牡丹3-22-3,35.668467,139.799128,医療法人社団豊珠会 あべ眼科クリニック,眼科,https://byoinnavi.jp/clinic/1982
江東区,大島１丁目,-,東京都江東区大島1丁目2-2 ザ・ガーデンタワーズ サンセットタワー1F,35.687871,139.820901,医療法人社団江翔会 ekoデンタルクリニック,"歯科, 小児歯科, 歯科口腔外科",https://byoinnavi.jp/clinic/8067
江東区,大島９丁目,-,東京都江東区大島9丁目5-1 コアシティ東大島101,35.692415,139.844312,東大島レディースクリニック,"内科, 婦人科",https://byoinnavi.jp/clinic/7347
江東区,塩浜２丁目,-,東京都江東区塩浜2丁目5-23 汐浜サンハイツ104号,35.661588,139.805644,ゆき耳鼻咽喉科クリニック,耳鼻いんこう科,https://byoinnavi.jp/clinic/1977
江東区,大島６丁目,-,東京都江東区大島6丁目1-8 ピーコックストア大島店内,35.689832,139.832594,医療法人社団W.D.M 大島中央歯科クリニック,"歯科, 矯正歯科, 歯科口腔外科",https://byoinnavi.jp/clinic/271654
江東区,東陽３丁目,-,東京都江東区東陽3丁目4-5,35.669129,139.809863,医療法人社団Cosme Dental Concept 渡邉歯科,"歯科, 矯正歯科, 小児歯科, 歯科口腔外科",https://byoinnavi.jp/clinic/8010
江東区,北砂５丁目,-,東京都江東区北砂5丁目3-2 北砂5丁目ビル1F,35.681369,139.831686,医療法人社団正健会 小名木川歯科,"歯科, 矯正歯科, 小児歯科, 歯科口腔外科",https://byoinnavi.jp/clinic/267912
江東区,常盤２丁目,-,東京都江東区常盤2丁目13-16 1-B,35.68471,139.797811,life de 清澄白河クリニック,"精神科, 内科",https://byoinnavi.jp/clinic/271648
江東区,青海２丁目,-,東京都江東区青海2丁目5-10 テレコムセンタービルWEST3F,35.617362,139.780257,医療法人社団彩新会 テレコムセンタービルクリニック 台場健康管理センター,"内科, 外科, 胃腸科, 循環器科, 整形外科",https://byoinnavi.jp/clinic/4136
江東区,高橋,-,東京都江東区高橋13-15 藤江ビル3階,35.685582,139.798817,医療法人社団禎美会 佐藤皮膚科,皮膚科,https://byoinnavi.jp/clinic/1429
江東区,有明１丁目,-,東京都江東区有明1-4-11 Brillia Mare 有明 クリニックスペース,35.637162,139.787133,有明かぜまち内科クリニック,内科,https://byoinnavi.jp/clinic/279591
江東区,枝川１丁目,-,東京都江東区枝川1-6-20,35.657527,139.803419,橘クリニック,"泌尿器科, 内科",https://byoinnavi.jp/clinic/267505
江東区,北砂５丁目,-,東京都江東区北砂5丁目16-1,35.681717,139.834699,北原診療所,"内科, 小児科, 皮膚科",https://byoinnavi.jp/clinic/8133
江東区,東雲１丁目,-,東京都江東区東雲1-9-10 イオン東雲ショッピングセンター2F,35.64912,139.802345,医療法人社団 日の出会 イトカワ整形外科,"整形外科, リウマチ科, リハビリテーション科",https://byoinnavi.jp/clinic/792
江東区,扇橋３丁目,-,東京都江東区扇橋3-5-7 リバーサイド奥村101,35.682416,139.819793,医療法人社団敬松会 城東クリニック,"内科, 呼吸器科, 消化器科, 循環器科, 小児科",https://byoinnavi.jp/clinic/107372
江東区,門前仲町１丁目,-,東京都江東区門前仲町1-6-11 トレディパーチェ門前仲町3階,35.673028,139.794009,門前仲町内科クリニック,"内科, 消化器内科, 内視鏡内科, 肝臓内科",https://byoinnavi.jp/clinic/267234
江東区,豊洲２丁目,-,東京都江東区豊洲2-2-1 アーバンドックららぽーと3・4階,35.654869,139.794465,医療法人社団翔和仁誠会 豊洲ベイシティクリニック,"アレルギー科, 耳鼻いんこう科",https://byoinnavi.jp/clinic/256401
江東区,東砂４丁目,-,東京都江東区東砂4丁目23-6 城東レンタコムビル1F,35.680236,139.84066,医療法人社団俊智会 みやたけクリニック,"内科, 外科, 消化器科",https://byoinnavi.jp/clinic/7939
江東区,潮見２丁目,-,東京都江東区潮見2-7-1,35.657522,139.81749,潮見駅前内科クリニック,"内科, 消化器内科, 呼吸器内科",https://byoinnavi.jp/clinic/280086
江東区,豊洲５丁目,-,東京都江東区豊洲5丁目2-10 沢真ビル3階,35.653491,139.79554,澤井クリニック,"内科, 神経内科, 皮膚科",https://byoinnavi.jp/clinic/1124
江東区,南砂３丁目,-,東京都江東区南砂3丁目8-10,35.672343,139.830228,医療法人社団 かぶき内科,内科,https://byoinnavi.jp/clinic/8163
江東区,有明３丁目,-,東京都江東区有明3丁目6-11 TFTビル東館3F,35.630802,139.79058,東京ファッションタウンビルクリニック,"内科, 小児科, 皮膚科",https://byoinnavi.jp/clinic/2073
江東区,森下１丁目,-,東京都江東区森下1丁目6-14 レックス森下102,35.687074,139.79802,医療法人社団英裕会 伊藤整形外科医院,"整形外科, リハビリテーション科",https://byoinnavi.jp/clinic/692
江東区,東雲１丁目,-,東京都江東区東雲1丁目9-11 東雲キャナルコートCODAN1F,35.645867,139.803642,医療法人社団隆会 しののめ整形外科・外科クリニック,"外科, 整形外科, リハビリテーション科",https://byoinnavi.jp/clinic/1702
江東区,森下１丁目,-,東京都江東区森下1-16-7 太田ビル1階,35.688368,139.797256,森下駅前クリニック,"内科, 呼吸器内科, 循環器内科, 小児科",https://byoinnavi.jp/clinic/257437
江東区,北砂５丁目,-,東京都江東区北砂5丁目7-2,35.680045,139.833208,砂町銀座はた耳鼻咽喉科,"耳鼻いんこう科, アレルギー科, 小児耳鼻いんこう科",https://byoinnavi.jp/clinic/265403
江東区,大島５丁目,-,東京都江東区大島5丁目34-9 青木ビル1階,35.689638,139.834899,中の橋デンタルクリニック,"歯科, 矯正歯科, 小児歯科, 歯科口腔外科",https://byoinnavi.jp/clinic/7861
江東区,有明１丁目,-,東京都江東区有明1丁目3-17 ドゥーエ有明EAST 1F,35.638918,139.790968,医療法人社団世航会 デンタルオフィス東京ベイ,"歯科, 小児歯科, 歯科口腔外科",https://byoinnavi.jp/clinic/175632
江東区,豊洲３丁目,-,東京都江東区豊洲3丁目2-24 豊洲フォレシア1F,35.657574,139.794784,医療法人雄久会 豊洲フォレシア歯科クリニック,"歯科, 矯正歯科, 小児歯科, 歯科口腔外科",https://byoinnavi.jp/clinic/8099
江東区,大島３丁目,-,東京都江東区大島3-14-17 江口ビル2階,35.689588,139.82805,西大島あたらし眼科,眼科,https://byoinnavi.jp/clinic/274634
江東区,豊洲４丁目,-,東京都江東区豊洲4-10-18 プライヴブルー東京1階,35.654225,139.801636,豊洲はるそらファミリークリニック,"内科, 呼吸器内科, 循環器内科, 内分泌・糖尿病内科",https://byoinnavi.jp/clinic/274919
江東区,大島１丁目,-,東京都江東区大島1丁目33-15 小野ビル1F,35.688482,139.826206,医療法人社団 小野内科診療所,"内科, 胃腸科, 循環器科, 小児科",https://byoinnavi.jp/clinic/7481
江東区,亀戸２丁目,-,東京都江東区亀戸2丁目42-5 亀戸クリニックファーム4F,35.701438,139.823526,亀戸畠山クリニック,"内科, 外科, 皮膚科, 肛門科",https://byoinnavi.jp/clinic/268229
江東区,亀戸２丁目,-,東京都江東区亀戸2-42-5 亀戸クリニックファーム5F,35.701438,139.823526,ドクター小池クリニック,"内科, 皮膚科",https://byoinnavi.jp/clinic/183087
江東区,住吉２丁目,-,東京都江東区住吉2丁目7-6,35.688801,139.815294,すみよし婦人科クリニック,"皮膚科, 泌尿器科, 婦人科",https://byoinnavi.jp/clinic/73064
江東区,亀戸２丁目,-,東京都江東区亀戸2-42-5 亀戸クリニックファーム3F,35.701438,139.823526,山口整形外科,"整形外科, リハビリテーション科, リウマチ科",https://byoinnavi.jp/clinic/178656
江東区,青海２丁目,-,東京都江東区青海2-3-23,35.620375,139.778651,フジテレビ湾岸スタジオビル診療所,内科,https://byoinnavi.jp/clinic/4138
江東区,東砂４丁目,-,東京都江東区東砂4丁目22-1,35.679831,139.840318,医療法人社団 田尻整形外科,"整形外科, リハビリテーション科, リウマチ科",https://byoinnavi.jp/clinic/2172
江東区,森下１丁目,-,東京都江東区森下1丁目5-10 篠宮ビル2階,35.686449,139.798153,医療法人社団篠宮会 篠宮クリニック,"内科, 外科, 脳神経外科, 消化器科, 整形外科, リハビリテーション科",https://byoinnavi.jp/clinic/576
江東区,木場２丁目,-,東京都江東区木場2丁目7-15 第1びる別館南棟1F,35.670176,139.804353,木場メンタルクリニック,"心療内科, 精神科",https://byoinnavi.jp/clinic/1705
江東区,東陽３丁目,-,東京都江東区東陽3丁目5-9 フォレストコート木場1階,35.668976,139.810585,うと歯科クリニック,歯科,https://byoinnavi.jp/clinic/8072
江東区,三好４丁目,-,東京都江東区三好4丁目7-10 サウスフラッツ102,35.681088,139.808023,医療法人財団南葛勤医協 扇橋診療所,"内科, 消化器科, 循環器科, 皮膚科, 泌尿器科",https://byoinnavi.jp/clinic/1410
江東区,大島５丁目,-,東京都江東区大島5-36-8 宍戸ビル3F,35.689066,139.836291,うらべ医院,"精神科, 心療内科",https://byoinnavi.jp/clinic/7669
江東区,青海２丁目,-,東京都江東区青海2-5-10 テレコムセンタービルWest3階,35.617362,139.780257,医療法人社団駿亜会 テレコムセンターデンタルクリニック,"歯科, 矯正歯科, 小児歯科, 歯科口腔外科",https://byoinnavi.jp/clinic/4129
江東区,白河１丁目,-,東京都江東区白河1丁目2-11 越川ビル2階,35.681458,139.799224,白河クリニック,"心療内科, 精神科, 神経内科",https://byoinnavi.jp/clinic/1162
江東区,亀戸５丁目,-,東京都江東区亀戸5丁目8-9,35.69882,139.828669,梶山矯正歯科,矯正歯科,https://byoinnavi.jp/clinic/7776
江東区,門前仲町１丁目,-,東京都江東区門前仲町1丁目4-8 プラザ門前仲町9F,35.672156,139.794357,医療法人社団 優人会 東西線メディカルクリニック,"内科, 消化器科",https://byoinnavi.jp/clinic/119323
江東区,東砂７丁目,-,東京都江東区東砂7丁目19-13 ベルコモン南砂3階,35.673015,139.836324,まるやま皮膚科クリニック,"アレルギー科, 皮膚科",https://byoinnavi.jp/clinic/7826
