渋谷区,千駄ケ谷３丁目,-,東京都渋谷区千駄ヶ谷3-51-6 英和ビル2階,35.675037,139.706133,医療法人社団翠琳会 林デンタルオフィス,"歯科, 矯正歯科, 小児歯科, 歯科口腔外科",https://byoinnavi.jp/clinic/3656
渋谷区,広尾５丁目,-,東京都渋谷区広尾5丁目14-2 広尾KKビル5階,35.650331,139.721519,横山皮フ科クリニック,"アレルギー科, 皮膚科, 美容皮膚科",https://byoinnavi.jp/clinic/3585
渋谷区,東１丁目,-,東京都渋谷区東1丁目25-5,35.654403,139.708161,しぶや東歯科・口腔外科クリニック,"歯科, 矯正歯科, 小児歯科, 歯科口腔外科",https://byoinnavi.jp/clinic/10064
渋谷区,本町３丁目,-,東京都渋谷区本町3丁目53-3,35.686335,139.684101,医療法人社団輝生会 初台リハビリテーション病院,"神経内科, リハビリテーション科",https://byoinnavi.jp/clinic/4175
渋谷区,代々木２丁目,-,東京都渋谷区代々木二丁目37-15 秀和代々木レジデンス118号室,35.684955,139.697319,荒木歯科クリニック,歯科,https://byoinnavi.jp/clinic/5698
渋谷区,東３丁目,-,東京都渋谷区東三丁目15-12 第2アワヤビル2F,35.649878,139.709972,渋谷橋レディースクリニック,婦人科,https://byoinnavi.jp/clinic/3143
渋谷区,宇田川町,-,東京都渋谷区宇田川町36-2 ノア渋谷12階,35.662021,139.697209,アサミ美容外科渋谷院,美容外科,https://byoinnavi.jp/clinic/3631
渋谷区,恵比寿南２丁目,-,東京都渋谷区恵比寿南2丁目13-9 美芳ビル1F,35.642854,139.707895,楓の森メンタルクリニック,"心療内科, 精神科",https://byoinnavi.jp/clinic/254067
渋谷区,渋谷１丁目,-,東京都渋谷区渋谷1丁目6-7 ICIビル3F,35.660799,139.705439,新宿クレアクリニック渋谷院,美容皮膚科,https://byoinnavi.jp/clinic/264365
渋谷区,恵比寿２丁目,-,東京都渋谷区恵比寿2丁目12-13,35.645432,139.718497,山下歯科医院,"歯科, 矯正歯科, 小児歯科, 歯科口腔外科",https://byoinnavi.jp/clinic/3872
渋谷区,幡ケ谷２丁目,-,東京都渋谷区幡ケ谷2丁目14-12,35.677586,139.675927,医療法人社団回心会 回心堂病院,"内科, リハビリテーション科, 老年内科",https://byoinnavi.jp/clinic/11701
渋谷区,恵比寿１丁目,-,東京都渋谷区恵比寿1丁目26-17 阿部ビル3F,35.647223,139.7156,恵比寿美容皮膚科,美容皮膚科,https://byoinnavi.jp/clinic/281027
渋谷区,渋谷１丁目,-,東京都渋谷区渋谷1丁目8-7 第27SYビル5A,35.660269,139.705142,医療法人社団もくれん会 マグノリア皮膚科クリニック,美容皮膚科,https://byoinnavi.jp/clinic/861
渋谷区,恵比寿西１丁目,-,東京都渋谷区恵比寿西1丁目20-8 コンド恵比寿2階,35.646476,139.706512,AGAスキンクリニック恵比寿レディース院,皮膚科,https://byoinnavi.jp/clinic/280021
渋谷区,円山町,-,東京都渋谷区円山町10-18 マイキャッスル渋谷JP201,35.65911,139.694579,渋谷しろくまクリニック,"内科, 精神科",https://byoinnavi.jp/clinic/276952
渋谷区,千駄ケ谷１丁目,-,東京都渋谷区千駄ケ谷1丁目1-16,35.678072,139.709274,医療法人社団碧生会 水町エム・アールクリニック千駄ケ谷,放射線科,https://byoinnavi.jp/clinic/106209
渋谷区,広尾２丁目,-,東京都渋谷区広尾2丁目1-18 広尾Nビル2F,35.652575,139.713536,広尾鈴木デンタルクリニック,"歯科, 矯正歯科, 小児歯科",https://byoinnavi.jp/clinic/3705
渋谷区,渋谷２丁目,-,東京都渋谷区渋谷2丁目1-12 東京セントラル宮益坂上4階,35.661022,139.707853,原宿デンタルオフィス,歯科,https://byoinnavi.jp/clinic/167131
渋谷区,神宮前５丁目,-,東京都渋谷区神宮前五丁目13-2 パインアンダーフラット3階,35.666329,139.707283,医療法人社団医創会 セレンクリニック東京ハイジーア,内科,https://byoinnavi.jp/clinic/119303
渋谷区,渋谷２丁目,-,東京都渋谷区渋谷2丁目19-17 グローリア渋谷ビル601号室,35.659641,139.704086,医療法人社団快美会 松野矯正歯科,矯正歯科,https://byoinnavi.jp/clinic/9610
渋谷区,道玄坂１丁目,-,東京都渋谷区道玄坂1丁目9-3 大和ビル1F,35.657236,139.699679,道玄坂平賀クリニック,"内科, 外科, 呼吸器科, 消化器科",https://byoinnavi.jp/clinic/3649
渋谷区,渋谷３丁目,-,東京都渋谷区渋谷3丁目11-2 パインビル1階,35.656861,139.705925,医療法人社団甲和会 渋谷DSクリニック,"内科, 美容外科, 皮膚科",https://byoinnavi.jp/clinic/3626
渋谷区,神宮前６丁目,-,東京都渋谷区神宮前6丁目35-3 コープオリンピア,35.669107,139.703439,医療法人社団オリンピア会 オリンピア・クリニック井上眼科,眼科,https://byoinnavi.jp/clinic/3841
渋谷区,渋谷３丁目,-,東京都渋谷区渋谷3丁目6-2 エクラート渋谷ビル2F,35.657925,139.704975,匠デンタルクリニック,"歯科, 矯正歯科, 小児歯科, 歯科口腔外科",https://byoinnavi.jp/clinic/256557
渋谷区,元代々木町,-,東京都渋谷区元代々木町55-7 桜苑マンション1階,35.673361,139.687412,元代々木歯科医院,"歯科, 小児歯科",https://byoinnavi.jp/clinic/5651
渋谷区,千駄ケ谷１丁目,-,東京都渋谷区千駄ケ谷一丁目21-13 ネオマイム千駄ケ谷101号,35.678689,139.709968,青山メディカル・インターナショナル・クリニック,"内科, 心療内科",https://byoinnavi.jp/clinic/3348
渋谷区,神宮前４丁目,-,東京都渋谷区神宮前四丁目11-6 表参道千代田ビル9F,35.666632,139.71008,医療法人社団松徳会 松倉クリニック表参道,"内科, 形成外科, 美容外科, 皮膚科",https://byoinnavi.jp/clinic/3393
渋谷区,千駄ケ谷５丁目,-,東京都渋谷区千駄ケ谷五丁目24-2 新宿高島屋11F,35.686021,139.702427,新宿高島屋眼科診療所,眼科,https://byoinnavi.jp/clinic/4193
渋谷区,初台１丁目,-,東京都渋谷区初台1丁目12-13,35.679055,139.686726,初台眼科医院,眼科,https://byoinnavi.jp/clinic/5815
渋谷区,広尾５丁目,-,東京都渋谷区広尾5丁目3-15 3F,35.650384,139.720752,広尾本間クリニック,"内科, 消化器科, 循環器科",https://byoinnavi.jp/clinic/2752
渋谷区,広尾５丁目,-,東京都渋谷区広尾5丁目11-14,35.649665,139.721671,医療法人社団博聖会 広尾整形外科,"整形外科, リハビリテーション科",https://byoinnavi.jp/clinic/2276
渋谷区,渋谷１丁目,-,東京都渋谷区渋谷1丁目21-12,35.663454,139.70347,小野クリニック,"内科, 外科, 脳神経外科, 整形外科",https://byoinnavi.jp/clinic/3805
渋谷区,神宮前１丁目,-,東京都渋谷区神宮前1丁目14-25 クロスアベニュー原宿5F,35.669982,139.703039,トイトイトイクリニック,美容外科,https://byoinnavi.jp/clinic/263892
渋谷区,代々木１丁目,-,東京都渋谷区代々木1丁目32-12 HOUWAビル8F,35.682658,139.702069,代々木三春堂歯科診療所,歯科,https://byoinnavi.jp/clinic/267342
渋谷区,広尾１丁目,-,東京都渋谷区広尾1丁目1-7 プライムスクエアシティ802,35.649898,139.713242,満尾クリニック,内科,https://byoinnavi.jp/clinic/170119
渋谷区,神宮前５丁目,-,東京都渋谷区神宮前5丁目21-20 タウンハウス神宮前1-C,35.665188,139.705053,表参道MJMデンタルオフィス,"歯科, 矯正歯科, 小児歯科",https://byoinnavi.jp/clinic/273544
渋谷区,上原２丁目,-,東京都渋谷区上原2丁目48-11 ハニハラビル2F,35.667778,139.681894,石川歯科医院,"歯科, 小児歯科, 歯科口腔外科",https://byoinnavi.jp/clinic/9809
渋谷区,松涛１丁目,-,東京都渋谷区松濤1丁目4-9 サンエルサビル103,35.662318,139.695062,守屋歯科医院,"歯科, 小児歯科, 歯科口腔外科",https://byoinnavi.jp/clinic/12440
渋谷区,道玄坂２丁目,-,東京都渋谷区道玄坂2丁目11-3 ストークビル道玄坂3F,35.657794,139.696184,佐々木歯科医院,歯科,https://byoinnavi.jp/clinic/9625
渋谷区,恵比寿西１丁目,-,東京都渋谷区恵比寿西1丁目2-7 恵比寿UKビル2F,35.64824,139.708864,医療法人社団尽歯会 前田歯科医院,歯科,https://byoinnavi.jp/clinic/12427
渋谷区,代々木２丁目,-,東京都渋谷区代々木2丁目10-1 新宿サンセイビル6F,35.688102,139.698252,新宿ビューティークリニック新宿院,"美容外科, 美容皮膚科",https://byoinnavi.jp/clinic/174735
渋谷区,渋谷１丁目,-,東京都渋谷区渋谷1丁目15-22 上村会館3階,35.660946,139.702623,小谷松歯科医院,歯科,https://byoinnavi.jp/clinic/12441
渋谷区,幡ケ谷２丁目,-,東京都渋谷区幡ケ谷2丁目14-9 ヤナギヤビル2F,35.677286,139.67603,後藤歯科医院,歯科,https://byoinnavi.jp/clinic/145187
渋谷区,猿楽町,-,東京都渋谷区猿楽町9-8 URBAN PARK代官山Ⅰ 101,35.651642,139.702512,真崎医院,"美容外科, 麻酔科, 美容皮膚科",https://byoinnavi.jp/clinic/2318
渋谷区,東３丁目,-,東京都渋谷区東3丁目25-7 永源ビル2F,35.64849,139.710064,五味歯科医院,歯科,https://byoinnavi.jp/clinic/12424
渋谷区,千駄ケ谷１丁目,-,東京都渋谷区千駄ケ谷1丁目7-14 MHOUSE1階,35.67845,139.710227,代々木矯正歯科診療所,矯正歯科,https://byoinnavi.jp/clinic/4165
渋谷区,恵比寿南１丁目,-,東京都渋谷区恵比寿南一丁目1-1 ヒューマックスビル4F,35.646745,139.708931,医療法人道心会 恵比寿内科クリニック,内科,https://byoinnavi.jp/clinic/170223
渋谷区,南平台町,-,東京都渋谷区南平台町15-13 帝都渋谷ビル1階,35.655352,139.695376,南平台歯科クリニック,"歯科, 矯正歯科",https://byoinnavi.jp/clinic/269351
渋谷区,神南１丁目,-,東京都渋谷区神南1丁目20-15 神南101ビル4F,35.662177,139.699848,医療法人社団エムエフシー 銀座ファインケアクリニック 渋谷院,"形成外科, 美容外科",https://byoinnavi.jp/clinic/268784
渋谷区,笹塚１丁目,-,東京都渋谷区笹塚一丁目56-10 メディパーク笹塚2階,35.674289,139.667975,笹塚ひかり眼科,眼科,https://byoinnavi.jp/clinic/273383
渋谷区,代々木４丁目,-,東京都渋谷区代々木4丁目5-7 参宮橋ビル102,35.678594,139.693039,参宮橋駅前歯科,"歯科, 矯正歯科, 小児歯科",https://byoinnavi.jp/clinic/269694
渋谷区,宇田川町,-,東京都渋谷区宇田川町33-8 塚田ビル5階,35.660816,139.696912,コスメディカルクリニックシンシア渋谷院,"形成外科, 美容外科",https://byoinnavi.jp/clinic/270396
渋谷区,千駄ケ谷４丁目,-,東京都渋谷区千駄ケ谷4丁目27-1 神宮外苑ビル2F,35.680597,139.704147,神宮外苑かさはら歯科,"歯科, 矯正歯科, 小児歯科, 歯科口腔外科",https://byoinnavi.jp/clinic/270905
渋谷区,代々木１丁目,-,東京都渋谷区代々木1丁目55-5,35.684347,139.700816,モミの木診療所,形成外科,https://byoinnavi.jp/clinic/271752
渋谷区,恵比寿３丁目,-,東京都渋谷区恵比寿3丁目25-2,35.64304,139.716542,オーバルデンタル,"歯科, 矯正歯科, 小児歯科, 歯科口腔外科",https://byoinnavi.jp/clinic/270404
渋谷区,南平台町,-,東京都渋谷区南平台町13-1 サトウビル3F,35.655269,139.695935,医療法人社団慶緒会 南平台緒方クリニック,"アレルギー科, 形成外科, 美容外科, 皮膚科",https://byoinnavi.jp/clinic/182024
渋谷区,神宮前５丁目,-,東京都渋谷区神宮前五丁目3-2,35.664824,139.708902,ゲンズデンタルオフィス,歯科,https://byoinnavi.jp/clinic/9603
渋谷区,渋谷２丁目,-,東京都渋谷区渋谷2丁目19-15 宮益坂ビルディング1F,35.659583,139.703756,たいなクリニック,"内科, 消化器内科, 肝臓内科",https://byoinnavi.jp/clinic/280147
渋谷区,恵比寿南１丁目,-,東京都渋谷区恵比寿南一丁目14-12 ルソレイユ3 3F,35.645134,139.709895,恵比寿みかレディースクリニック,"内科, 婦人科",https://byoinnavi.jp/clinic/271748
渋谷区,恵比寿４丁目,-,東京都渋谷区恵比寿4丁目3-1 QIZ EBISU3階,35.646134,139.711295,とよまき矯正歯科,矯正歯科,https://byoinnavi.jp/clinic/182131
渋谷区,東３丁目,-,東京都渋谷区東3丁目14-13 ひがし健康プラザ,35.651362,139.709634,公益社団法人渋谷区歯科医師会 渋谷区口腔保健支援センタープラザ歯科診療所,歯科,https://byoinnavi.jp/clinic/12420
渋谷区,笹塚１丁目,-,東京都渋谷区笹塚1丁目22-1,35.673161,139.668089,医療法人社団RMC 笹塚RMCクリニック,"内科, 整形外科, リハビリテーション科",https://byoinnavi.jp/clinic/180539
渋谷区,恵比寿西１丁目,-,東京都渋谷区恵比寿西1丁目24-11 コートドール代官山201,35.647262,139.705234,Green Forest 代官山クリニック,"内科, アレルギー科, 外科, 皮膚科",https://byoinnavi.jp/clinic/278715
渋谷区,恵比寿南３丁目,-,東京都渋谷区恵比寿南三丁目2-18,35.646173,139.705354,永井歯科医院,歯科,https://byoinnavi.jp/clinic/10038
渋谷区,幡ケ谷３丁目,-,東京都渋谷区幡ケ谷3丁目48-10,35.680785,139.673008,橋本医院,"内科, 皮膚科",https://byoinnavi.jp/clinic/11696
渋谷区,初台１丁目,-,東京都渋谷区初台1丁目47-3 小田急初台ビル2F,35.681885,139.688018,大月歯科医院,歯科,https://byoinnavi.jp/clinic/5710
渋谷区,恵比寿西１丁目,-,東京都渋谷区恵比寿西1丁目10-8 本間ビル3F,35.646562,139.707642,本間歯科医院,"歯科, 小児歯科, 歯科口腔外科",https://byoinnavi.jp/clinic/9685
渋谷区,恵比寿南１丁目,-,東京都渋谷区恵比寿南1丁目11-13 恵比寿ヴェルソービル4F,35.645287,139.708517,Taide Suenaga Clinic,"美容外科, 美容皮膚科",https://byoinnavi.jp/clinic/278705
渋谷区,神宮前２丁目,-,東京都渋谷区神宮前2丁目18-15 ワンエイスビル2F,35.672923,139.709677,APOLLO BEAUTY CLINIC,"美容外科, 美容皮膚科",https://byoinnavi.jp/clinic/278712
渋谷区,神宮前６丁目,-,東京都渋谷区神宮前6丁目26-1,35.666846,139.702517,一般社団法人巨樹の会 原宿リハビリテーション病院,リハビリテーション科,https://byoinnavi.jp/clinic/258470
渋谷区,宇田川町,-,東京都渋谷区宇田川町33-1 グランド東京渋谷ビル7階,35.660744,139.697398,医療法人社団直悠会 にしたんクリニック渋谷院,内科,https://byoinnavi.jp/clinic/279201
渋谷区,恵比寿西２丁目,-,東京都渋谷区恵比寿西2丁目21-4 代官山PARKS2F,35.648128,139.704042,医療法人ドクタースパ ドクタースパ・クリニック,"形成外科, 美容外科, 美容皮膚科",https://byoinnavi.jp/clinic/180239
渋谷区,南平台町,-,東京都渋谷区南平台町1-9 南平台宝来ビル3F,35.655772,139.696837,坪水クリニック,胃腸科,https://byoinnavi.jp/clinic/3717
渋谷区,上原１丁目,-,東京都渋谷区上原1丁目35-2 野口ビル2F,35.669703,139.682049,小山歯科クリニック,歯科,https://byoinnavi.jp/clinic/10087
渋谷区,恵比寿１丁目,-,東京都渋谷区恵比寿1丁目8-14 大黒ビル2F,35.64784,139.70985,恵比寿歯科診療所,歯科,https://byoinnavi.jp/clinic/10212
渋谷区,神宮前５丁目,-,東京都渋谷区神宮前五丁目46-7 GEMS AOYAMA CROSS 2F,35.663868,139.708783,R.O.clinic,"形成外科, 美容外科, 美容皮膚科",https://byoinnavi.jp/clinic/279783
渋谷区,笹塚２丁目,-,東京都渋谷区笹塚二丁目22-5 セイワパラシオン笹塚103,35.673758,139.663895,石川歯科クリニック,"歯科, 小児歯科",https://byoinnavi.jp/clinic/11658
渋谷区,初台１丁目,-,東京都渋谷区初台1丁目39-6,35.679863,139.687445,袖山歯科医院,"歯科, 矯正歯科, 小児歯科",https://byoinnavi.jp/clinic/5656
渋谷区,恵比寿西１丁目,-,東京都渋谷区恵比寿西1丁目12-8 グレースコート2階,35.647209,139.707514,かまち歯科クリニック,"歯科, 小児歯科",https://byoinnavi.jp/clinic/9581
渋谷区,渋谷１丁目,-,東京都渋谷区渋谷1丁目12-12 宮益坂東豊エステート,35.660069,139.704356,松尾歯科,歯科,https://byoinnavi.jp/clinic/12460
渋谷区,宇田川町,-,東京都渋谷区宇田川町32-12 アソルティ渋谷2階,35.66106,139.697368,Ark CLINIC,"美容外科, 美容皮膚科",https://byoinnavi.jp/clinic/279935
渋谷区,神宮前３丁目,-,東京都渋谷区神宮前3丁目4-7 エルム青山2F,35.668701,139.712533,医療法人社団美星会 東京表参道BeLumiクリニック,"形成外科, 美容外科, 美容皮膚科",https://byoinnavi.jp/clinic/276704
渋谷区,恵比寿４丁目,-,東京都渋谷区恵比寿四丁目6-10 恵比寿ホークビル2F,35.645671,139.712217,木下歯科医院,"歯科, 小児歯科",https://byoinnavi.jp/clinic/9688
渋谷区,広尾５丁目,-,東京都渋谷区広尾5丁目8-12 広尾飯田ビル3F,35.648134,139.721719,飯田歯科医院,歯科,https://byoinnavi.jp/clinic/3912
渋谷区,神宮前１丁目,-,東京都渋谷区神宮前1丁目10-5,35.670004,139.704728,一般社団法人千翔会 HAAB DREAM BEAUTY CLINIC,"美容外科, 美容皮膚科",https://byoinnavi.jp/clinic/278717
渋谷区,恵比寿西１丁目,-,東京都渋谷区恵比寿西1丁目30-1 シーズ代官山3F,35.648726,139.70632,佐々木歯科医院,"歯科, 矯正歯科, 小児歯科",https://byoinnavi.jp/clinic/9592
渋谷区,恵比寿南２丁目,-,東京都渋谷区恵比寿南2丁目9-5 恵比寿南ハウス1階,35.643876,139.709548,宮本歯科医院,歯科,https://byoinnavi.jp/clinic/9701
渋谷区,代官山町,-,東京都渋谷区代官山町17-1 代官山アドレスザタワー302,35.649192,139.703462,医療法人社団美光会 セラクリニック,"美容外科, 美容皮膚科",https://byoinnavi.jp/clinic/2603
渋谷区,笹塚１丁目,-,東京都渋谷区笹塚1丁目56-6 笹塚クレセントプラザ40A,35.674155,139.667511,桧垣歯科医院,歯科,https://byoinnavi.jp/clinic/11675
渋谷区,恵比寿２丁目,-,東京都渋谷区恵比寿二丁目5-1,35.647787,139.717716,斉藤歯科診療所,歯科,https://byoinnavi.jp/clinic/145038
渋谷区,桜丘町,-,東京都渋谷区桜丘町13-2,35.654961,139.701679,芳村歯科医院,歯科,https://byoinnavi.jp/clinic/9621
渋谷区,恵比寿１丁目,-,東京都渋谷区恵比寿1丁目9-7 ITOXビル2階,35.646879,139.711206,伊藤歯科医院,歯科,https://byoinnavi.jp/clinic/10211
渋谷区,初台１丁目,-,東京都渋谷区初台一丁目49-3 初台パークサイドハイツ206号,35.681133,139.68722,川戸医院歯科,歯科,https://byoinnavi.jp/clinic/5693
渋谷区,代々木２丁目,-,東京都渋谷区代々木2丁目16-7 山葉ビル2F,35.686685,139.695847,東京メモリアルクリニック・平山,"形成外科, 美容外科",https://byoinnavi.jp/clinic/4607
渋谷区,代々木１丁目,-,東京都渋谷区代々木1丁目13-9 アン・クロイワ3階,35.682119,139.699889,菊地歯科医院,"歯科, 歯科口腔外科",https://byoinnavi.jp/clinic/145010
渋谷区,千駄ケ谷２丁目,-,東京都渋谷区千駄ケ谷2丁目37-4,35.677384,139.710041,せんだがや皮膚科,皮膚科,https://byoinnavi.jp/clinic/4072
渋谷区,笹塚３丁目,-,東京都渋谷区笹塚3丁目9-3 ケイオービル1F,35.677322,139.669372,笹塚歯科,歯科,https://byoinnavi.jp/clinic/11644
渋谷区,神宮前２丁目,-,東京都渋谷区神宮前二丁目33-16 チサンマンション原宿405号,35.673573,139.708408,木下歯科医院,"歯科, 小児歯科, 歯科口腔外科",https://byoinnavi.jp/clinic/3683
渋谷区,鴬谷町,-,東京都渋谷区鶯谷町6-5,35.654108,139.702742,桜丘歯科クリニック,"歯科, 小児歯科, 歯科口腔外科",https://byoinnavi.jp/clinic/257265
渋谷区,初台１丁目,-,東京都渋谷区初台一丁目48-4,35.681577,139.687334,石崎耳鼻咽喉科医院,耳鼻いんこう科,https://byoinnavi.jp/clinic/5793
渋谷区,神山町,-,東京都渋谷区神山町40-4 大月ビル2F,35.664729,139.692923,大月歯科医院,歯科,https://byoinnavi.jp/clinic/10077
渋谷区,神宮前６丁目,-,東京都渋谷区神宮前6丁目23-5,35.664935,139.702414,鈴木歯科医院,歯科,https://byoinnavi.jp/clinic/12462
渋谷区,東３丁目,-,東京都渋谷区東3丁目26-3 恵比寿フラワーホーム504号,35.648409,139.709559,遠藤歯科医院,"歯科, 小児歯科, 歯科口腔外科",https://byoinnavi.jp/clinic/10035
渋谷区,恵比寿１丁目,-,東京都渋谷区恵比寿1丁目24-4 恵比寿ハートビル,35.646884,139.71553,一般財団法人日本健康増進財団 恵比寿ハートビル診療所,"内科, 循環器科",https://byoinnavi.jp/clinic/256409
渋谷区,恵比寿西１丁目,-,東京都渋谷区恵比寿西1丁目21-3 グレイス代官山2F,35.646445,139.706281,医療法人社団ホワイト会 ホワイトニング東京,歯科,https://byoinnavi.jp/clinic/10039
渋谷区,千駄ケ谷５丁目,-,東京都渋谷区千駄ケ谷5丁目5-3,35.681914,139.707096,笠茂歯科医院,歯科,https://byoinnavi.jp/clinic/4156
渋谷区,代官山町,-,東京都渋谷区代官山町10-10 DAIKANYAMA TWELVE2-D号,35.65102,139.704201,高橋歯科医院,"歯科, 矯正歯科, 小児歯科, 歯科口腔外科",https://byoinnavi.jp/clinic/9541
渋谷区,広尾５丁目,-,東京都渋谷区広尾5丁目2-25 本国ビル4F,35.650256,139.720258,デンタルクリニック広尾スマイルライン,"歯科, 小児歯科, 歯科口腔外科",https://byoinnavi.jp/clinic/3664
渋谷区,恵比寿南１丁目,-,東京都渋谷区恵比寿南1丁目13-11 ヴェール302,35.645771,139.710173,和歌矯正歯科,矯正歯科,https://byoinnavi.jp/clinic/150757
渋谷区,西原３丁目,-,東京都渋谷区西原三丁目20-7 南ビル4F,35.670445,139.681155,西堀歯科医院,歯科,https://byoinnavi.jp/clinic/10083
渋谷区,代官山町,-,東京都渋谷区代官山町14-24 ワイエム代官山2階,35.650642,139.703312,リキ歯科クリニック,"歯科, 小児歯科, 歯科口腔外科",https://byoinnavi.jp/clinic/9561
渋谷区,西原３丁目,-,東京都渋谷区西原3丁目13-16 パリス代々木上原1F,35.669709,139.679891,代々木上原眼科,眼科,https://byoinnavi.jp/clinic/5812
渋谷区,上原３丁目,-,東京都渋谷区上原3丁目44-10 田口ビル1F,35.668101,139.67853,たぐち歯科医院,歯科,https://byoinnavi.jp/clinic/10080
渋谷区,笹塚１丁目,-,東京都渋谷区笹塚1丁目59-10 ACT SOHO KEIO笹塚2F,35.673575,139.665392,稲冨歯科医院,歯科,https://byoinnavi.jp/clinic/11670
渋谷区,千駄ケ谷３丁目,-,東京都渋谷区千駄ケ谷3丁目26-5 金子ビル1階,35.676959,139.707516,医療法人社団志高会 斎藤歯科クリニック,"歯科, 小児歯科, 歯科口腔外科",https://byoinnavi.jp/clinic/3661
渋谷区,恵比寿４丁目,-,東京都渋谷区恵比寿4丁目1-18 恵比寿ネオナート2階,35.645579,139.71105,松林歯科,歯科,https://byoinnavi.jp/clinic/9116
渋谷区,代々木２丁目,-,東京都渋谷区代々木2丁目12-1 記録映画社ビル3階,35.686596,139.697797,心の杜・新宿クリニック,"心療内科, 精神科",https://byoinnavi.jp/clinic/4141
渋谷区,千駄ケ谷３丁目,-,東京都渋谷区千駄ケ谷3丁目63-2 MJ原宿ビル4階,35.672976,139.703675,医療法人社団四誓会 原宿外苑矯正歯科,矯正歯科,https://byoinnavi.jp/clinic/252226
渋谷区,神宮前１丁目,-,東京都渋谷区神宮前1丁目19-14 サンキュービル4階,35.672129,139.70338,木林歯科,"歯科, 矯正歯科, 小児歯科, 歯科口腔外科",https://byoinnavi.jp/clinic/4151
渋谷区,神宮前３丁目,-,東京都渋谷区神宮前3丁目22-1 神宮前スクエア201,35.670332,139.707536,医療法人社団在心会 表参道デンタルオフィス,歯科,https://byoinnavi.jp/clinic/258884
渋谷区,笹塚１丁目,-,東京都渋谷区笹塚1丁目24-2 トーシンフェニックス笹塚参番館104,35.671847,139.668564,N.S.デンタルクリニック,"歯科, 矯正歯科, 小児歯科, 歯科口腔外科",https://byoinnavi.jp/clinic/267919
渋谷区,渋谷３丁目,-,東京都渋谷区渋谷3丁目15-4 2F,35.6557,139.705759,みやぎし歯科クリニック,"歯科, 矯正歯科, 小児歯科, 歯科口腔外科",https://byoinnavi.jp/clinic/182792
渋谷区,本町５丁目,-,東京都渋谷区本町5丁目40-5 パークサイドオー1階,35.682141,139.674949,医療法人社団TMT会 ティーエムティーデンタルクリニック,"歯科, 歯科口腔外科",https://byoinnavi.jp/clinic/11646
渋谷区,桜丘町,-,東京都渋谷区桜丘町20-12 ル・カルティエ桜丘202,35.655133,139.700429,北西クリニック,精神科,https://byoinnavi.jp/clinic/252312
渋谷区,本町３丁目,-,東京都渋谷区本町3丁目10-9 Qフラッツ1階,35.688993,139.683079,豊田歯科クリニック,歯科,https://byoinnavi.jp/clinic/12401
渋谷区,恵比寿１丁目,-,東京都渋谷区恵比寿1丁目20-27 エストエビス2F,35.646848,139.71237,恵比寿エスト矯正歯科,"歯科, 矯正歯科",https://byoinnavi.jp/clinic/3905
渋谷区,宇田川町,-,東京都渋谷区宇田川町12-17 プロトビル5F,35.662152,139.697781,ミヤオデンタルクリニック,"歯科, 歯科口腔外科",https://byoinnavi.jp/clinic/9568
渋谷区,神南１丁目,-,東京都渋谷区神南一丁目20-9 パークウェイ渋谷7階,35.661974,139.699859,村松歯科,"歯科, 矯正歯科, 小児歯科",https://byoinnavi.jp/clinic/145193
