新宿区,西新宿５丁目,-,東京都新宿区西新宿5丁目5-1 ザ・パークハウス西新宿タワー60 107・108号室,35.693837,139.686703,医療法人社団世航会 西新宿デンタルオフィス東京,"歯科, 矯正歯科, 小児歯科, 歯科口腔外科",https://byoinnavi.jp/clinic/269090
新宿区,高田馬場１丁目,-,東京都新宿区高田馬場1丁目1-13 セントエルモ西早稲田1階,35.709319,139.709048,タスクデンタルオフィス,"歯科, 矯正歯科, 小児歯科, 歯科口腔外科",https://byoinnavi.jp/clinic/178171
新宿区,高田馬場３丁目,-,東京都新宿区高田馬場3丁目2-5 ANビル5F,35.713902,139.703037,医療法人社団栄光会 冨岡歯科医院,歯科,https://byoinnavi.jp/clinic/5905
新宿区,馬場下町,-,東京都新宿区馬場下町62,35.706511,139.71938,医療法人社団秀飛会 優ビル歯科医院,"歯科, 矯正歯科, 小児歯科, 歯科口腔外科",https://byoinnavi.jp/clinic/5969
新宿区,市谷柳町,-,東京都新宿区市谷柳町15-1 プラウド市谷柳町101,35.698473,139.725647,なかそねデンタルクリニック牛込柳町,"歯科, 矯正歯科, 小児歯科, 歯科口腔外科",https://byoinnavi.jp/clinic/270041
千代田区,神田駿河台２丁目,-,東京都千代田区神田駿河台2丁目9-18 萬水ビル2F,35.700032,139.759608,木本歯科,"歯科, 矯正歯科, 小児歯科, 歯科口腔外科",https://byoinnavi.jp/clinic/6732
千代田区,神田岩本町,-,東京都千代田区神田岩本町1 岩本町ビル4階,35.696061,139.774816,医療法人社団 鈴森内科クリニック,"内科, 消化器科",https://byoinnavi.jp/clinic/643
千代田区,丸の内１丁目,大丸有,東京都千代田区丸の内1丁目6-1 丸ノ内センタービル1F,35.684037,139.765919,医療法人社団富泉会 丸ノ内センタービル歯科,"歯科, 歯科口腔外科",https://byoinnavi.jp/clinic/18274
千代田区,神田淡路町１丁目,-,東京都千代田区神田淡路町一丁目4 国土淡路町ビル4F,35.695997,139.767816,神田淡路町メンタルクリニック,"心療内科, 精神科",https://byoinnavi.jp/clinic/252018
千代田区,鍛冶町２丁目,-,東京都千代田区鍛冶町2丁目2-9 第2登栄ビル3F,35.691536,139.771421,神田歯科医院,"歯科, 歯科口腔外科",https://byoinnavi.jp/clinic/1914
千代田区,丸の内２丁目,大丸有,東京都千代田区丸の内2丁目4-1 丸の内ビルディング11階1101区,35.681079,139.76383,医療法人社団東杏会 丸ビル歯科医院,歯科,https://byoinnavi.jp/clinic/18276
千代田区,大手町１丁目,大丸有,東京都千代田区大手町1丁目6-1 大手町ビル1F,35.686295,139.764219,医療法人社団親光会 大手町ビル歯科,"歯科, 矯正歯科, 小児歯科, 歯科口腔外科",https://byoinnavi.jp/clinic/18282
千代田区,大手町２丁目,大丸有,東京都千代田区大手町二丁目2-1 新大手町ビル1F,35.685276,139.767055,医療法人社団明裕会 新大手町ビル歯科医院,"歯科, 矯正歯科",https://byoinnavi.jp/clinic/548
千代田区,永田町２丁目,赤坂,東京都千代田区永田町2丁目11-1 山王パークタワー25F,35.673571,139.740394,医療法人社団しおん緑山会 古市歯科医院,"歯科, 矯正歯科, 小児歯科",https://byoinnavi.jp/clinic/3377
千代田区,外神田２丁目,-,東京都千代田区外神田2丁目2-3 京須ビル1F,35.699913,139.767332,久保村歯科医院,歯科,https://byoinnavi.jp/clinic/6729
千代田区,神田佐久間町１丁目,-,東京都千代田区神田佐久間町1丁目26 第七砂川ビル6階,35.698775,139.775143,小林歯科クリニック,歯科,https://byoinnavi.jp/clinic/1366
千代田区,麹町５丁目,-,東京都千代田区麹町5丁目3-14 ヒルトップハウス2F,35.684383,139.733191,医療法人社団NDO 初谷歯科医院,"歯科, 矯正歯科, 歯科口腔外科",https://byoinnavi.jp/clinic/3385
千代田区,神田小川町１丁目,-,東京都千代田区神田小川町1丁目4 和田ビル3F,35.695347,139.766466,ジュネス歯科クリニック,"歯科, 矯正歯科, 小児歯科, 歯科口腔外科",https://byoinnavi.jp/clinic/1892
千代田区,神田須田町１丁目,-,東京都千代田区神田須田町1丁目3-3,35.696069,139.769483,山本歯科医院,"歯科, 矯正歯科, 小児歯科, 歯科口腔外科",https://byoinnavi.jp/clinic/18234
新宿区,山吹町,-,東京都新宿区山吹町348 DSDビル3・4F,35.708478,139.730671,江戸川橋鈴木クリニック,内科,https://byoinnavi.jp/clinic/4446
中央区,勝どき２丁目,-,東京都中央区勝どき2丁目9-14 勝どき二丁目富永ビル4F,35.659323,139.778127,勝どき二丁目クリニック,"脳神経内科, 心療内科, 内科, 精神科",https://byoinnavi.jp/clinic/1554
新宿区,西新宿７丁目,-,東京都新宿区西新宿7丁目11-9 バルビゾン87ビル4F,35.694148,139.697463,新宿ブレストセンター クサマクリニック,乳腺外科,https://byoinnavi.jp/clinic/6094
新宿区,西新宿４丁目,-,東京都新宿区西新宿4丁目31-3 リヴユール新宿2F,35.688354,139.688576,田口歯科医院,"歯科, 小児歯科, 歯科口腔外科",https://byoinnavi.jp/clinic/5706
中央区,八重洲１丁目,日八京,東京都中央区八重洲1丁目4-20 MTエステートビル2階,35.682496,139.770735,医療法人社団 高森会 東京駅前ユナイテッドクリニック,"内科, 皮膚科, 泌尿器科",https://byoinnavi.jp/clinic/275887
新宿区,西早稲田１丁目,-,東京都新宿区西早稲田1-2-3,35.708036,139.717869,医療法人尾城会 尾城眼科医院,眼科,https://byoinnavi.jp/clinic/4516
新宿区,袋町,-,東京都新宿区袋町10 坂本DCビル2F,35.701232,139.738793,坂本歯科クリニック,"歯科, 矯正歯科, 小児歯科",https://byoinnavi.jp/clinic/4329
新宿区,左門町,-,東京都新宿区左門町13 磯部ビル2階,35.686194,139.719856,ブレインケアクリニック,"心療内科, 精神科, 内科",https://byoinnavi.jp/clinic/262190
中央区,銀座４丁目,-,東京都中央区銀座4-13-11 銀座M&Sビル4階,35.668953,139.768203,銀座まいにちクリニック,"内科, 皮膚科, アレルギー科, 泌尿器科",https://byoinnavi.jp/clinic/272996
中央区,八丁堀３丁目,-,東京都中央区八丁堀3丁目13-1 第四ミチワビル8F,35.675949,139.775355,ミチワクリニック,"心療内科, 内科",https://byoinnavi.jp/clinic/90
中央区,銀座１丁目,-,東京都中央区銀座1丁目3-9 マルイト銀座ビル3F,35.675155,139.766161,品川美容外科 銀座院,"美容皮膚科, 美容外科",https://byoinnavi.jp/clinic/182885
新宿区,西新宿１丁目,-,東京都新宿区西新宿1-7-1 松岡セントラルビル4F,35.691823,139.697739,医療法人新光会 新宿西口駅前眼科,眼科,https://byoinnavi.jp/clinic/5560
中央区,勝どき３丁目,-,東京都中央区勝どき3-5-5 AIP勝どき駅前ビル3階,35.658704,139.775789,勝どき駅前皮ふ科クリニック,"形成外科, 皮膚科, 美容皮膚科",https://byoinnavi.jp/clinic/269428
新宿区,西新宿１丁目,-,東京都新宿区西新宿1丁目22-15 グラフィオ西新宿5階,35.68906,139.696061,医療法人社団三幸会 新宿フェミークリニック,美容皮膚科,https://byoinnavi.jp/clinic/170361
新宿区,高田馬場２丁目,-,東京都新宿区高田馬場2丁目8-4 AUビル3F,35.711977,139.708395,花田歯科医院,"歯科, 小児歯科",https://byoinnavi.jp/clinic/5948
新宿区,上落合２丁目,-,東京都新宿区上落合2-25-3,35.711018,139.686903,伊藤メディカルクリニック,"内科, 外科, 血管外科, 循環器科, 皮膚科, アレルギー科",https://byoinnavi.jp/clinic/122558
新宿区,新宿４丁目,-,東京都新宿区新宿4-1-6 JR新宿ミライナタワー7F,35.68851,139.702544,ナビタスクリニック新宿,"内科, 小児科, 皮膚科",https://byoinnavi.jp/clinic/261213
新宿区,矢来町,-,東京都新宿区矢来町61-1,35.702306,139.732621,医療法人社団慶至会 矢来町耳鼻いんこう科医院,耳鼻いんこう科,https://byoinnavi.jp/clinic/162708
中央区,日本橋３丁目,日八京,東京都中央区日本橋3-4-16 東和八重洲ビル(旧:春陽堂ビル)5階,35.67999,139.770635,ルネスクリニック 東京,"内科, 泌尿器科",https://byoinnavi.jp/clinic/258727
新宿区,西新宿７丁目,-,東京都新宿区西新宿7-1-10 守矢ビル5F,35.694801,139.698891,いしい内科・外科クリニック,"内科, 消化器内科, 外科, 皮膚科, 泌尿器科",https://byoinnavi.jp/clinic/256120
中央区,銀座６丁目,-,東京都中央区銀座六丁目7-16 岩月ビルB1F,35.67058,139.76257,医療法人社団誠敬会 誠敬会クリニック銀座,"内科, 歯科",https://byoinnavi.jp/clinic/267293
中央区,日本橋本町４丁目,日八京,東京都中央区日本橋本町4丁目15-9 曽田ビル4F,35.690262,139.777005,医療法人社団さわやか済世 健診プラザ日本橋,内科,https://byoinnavi.jp/clinic/258348
中央区,日本橋人形町２丁目,-,東京都中央区日本橋人形町2-35-5 DKJ人人形町ビル3階,35.685251,139.78598,人形町耳鼻咽喉科めまいクリニック,"耳鼻いんこう科, アレルギー科",https://byoinnavi.jp/clinic/263854
中央区,八丁堀３丁目,-,東京都中央区八丁堀3丁目26-8 高橋ビル2階,35.674766,139.778788,八丁堀眼科クリニック,眼科,https://byoinnavi.jp/clinic/1086
中央区,八重洲１丁目,日八京,東京都中央区八重洲1-5-9 八重洲アメレックスビル9階,35.681776,139.771319,医療法人社団東横会 たわらクリニック東京,"心療内科, 精神科",https://byoinnavi.jp/clinic/251174
新宿区,西新宿２丁目,-,東京都新宿区西新宿二丁目3番2号 KDDIビル1階,35.687985,139.694792,医療法人社団慶潤会 KDDIビルクリニック,内科,https://byoinnavi.jp/clinic/182760
新宿区,北新宿１丁目,-,東京都新宿区北新宿1丁目1-11・2F,35.698681,139.696602,第二浜野歯科医院,"歯科, 歯科口腔外科",https://byoinnavi.jp/clinic/5602
中央区,京橋１丁目,日八京,東京都中央区京橋1-1-9 LEO八重洲ビル8階,35.67906,139.771224,医療法人社団福美会 ヒロクリニックNIPT東京駅前院,臨床検査科,https://byoinnavi.jp/clinic/278159
中央区,築地１丁目,-,東京都中央区築地1-13-11,35.667742,139.769833,医療法人社団慶友 慶友銀座クリニック,"耳鼻いんこう科, 気管食道科, アレルギー科, 内科, 皮膚科",https://byoinnavi.jp/clinic/915
中央区,八重洲２丁目,日八京,東京都中央区八重洲2丁目4-11 八重洲H+ビル2階,35.678052,139.76913,八重洲さくら眼科,眼科,https://byoinnavi.jp/clinic/263540
千代田区,内幸町１丁目,-,東京都千代田区内幸町1丁目1-3,35.670261,139.758487,東京電力ホールディングス(株)中央健康管理室付属医務室,内科,https://byoinnavi.jp/clinic/170057
千代田区,富士見１丁目,-,東京都千代田区富士見1丁目2-27,35.698563,139.746748,関谷クリニック,"内科, 循環器科",https://byoinnavi.jp/clinic/4315
新宿区,神楽坂５丁目,-,東京都新宿区神楽坂五丁目21 亀十ビル2階,35.702348,139.737682,よしだ歯科医院,"歯科, 小児歯科, 歯科口腔外科",https://byoinnavi.jp/clinic/4328
新宿区,西新宿１丁目,-,東京都新宿区西新宿一丁目5-1 小田急ハルク7階,35.69259,139.698691,医療法人社団愛歯会 愛歯会デンタルオフィス,歯科,https://byoinnavi.jp/clinic/6088
新宿区,住吉町,-,東京都新宿区住吉町4-1 四谷ガーデニア1F,35.692652,139.720298,医療法人社団弘宣会 鈴木歯科医院,"歯科, 矯正歯科",https://byoinnavi.jp/clinic/4620
新宿区,西新宿１丁目,-,東京都新宿区西新宿1丁目26-2 新宿野村ビル5F,35.693004,139.695339,医療法人雄久会 新宿野村ビル歯科クリニック,"歯科, 矯正歯科, 小児歯科",https://byoinnavi.jp/clinic/122552
千代田区,神田錦町２丁目,-,東京都千代田区神田錦町2丁目5-18 黒子ビル1階,35.691914,139.762608,田村歯科,歯科,https://byoinnavi.jp/clinic/18301
千代田区,丸の内１丁目,大丸有,東京都千代田区丸の内一丁目4-5 三菱UFJ信託銀行本店ビル1F,35.683709,139.764664,野口デンタルクリニック,歯科,https://byoinnavi.jp/clinic/122423
千代田区,紀尾井町,赤坂,東京都千代田区紀尾井町4-1 ニューオータニガーデンコート1F,35.681175,139.734872,医療法人社団珠光会 BSL-48CLINIC,"内科, 外科",https://byoinnavi.jp/clinic/182417
千代田区,麹町１丁目,-,東京都千代田区麹町1丁目3 ダイアン麹町ビルB1F,35.683848,139.742121,千代田歯科医院,歯科,https://byoinnavi.jp/clinic/18210
千代田区,内幸町１丁目,-,東京都千代田区内幸町一丁目1-1 帝国ホテルタワー8F,35.672127,139.758928,クリニック宇津木流,"形成外科, 皮膚科",https://byoinnavi.jp/clinic/303
千代田区,岩本町３丁目,-,東京都千代田区岩本町三丁目1-8 Jサンクス第1ビル1階,35.694645,139.776057,もろおか歯科,"歯科, 矯正歯科, 小児歯科, 歯科口腔外科",https://byoinnavi.jp/clinic/262028
新宿区,西新宿３丁目,-,東京都新宿区西新宿三丁目7-1 新宿パークタワーN棟11F,35.685349,139.690884,医療法人社団四瑛会 新宿パークタワー歯科,"歯科, 矯正歯科, 小児歯科",https://byoinnavi.jp/clinic/5588
千代田区,神田駿河台３丁目,-,東京都千代田区神田駿河台3丁目3-5 小林ビル,35.695864,139.764172,医療法人社団霞会 波岡歯科,"歯科, 矯正歯科, 小児歯科, 歯科口腔外科",https://byoinnavi.jp/clinic/1902
千代田区,鍛冶町２丁目,-,東京都千代田区鍛冶町2丁目2-9 第2登栄ビル4F,35.691536,139.771421,広川眼科,眼科,https://byoinnavi.jp/clinic/1057
新宿区,高田馬場２丁目,-,東京都新宿区高田馬場2丁目16-2 土屋ビル1F,35.713577,139.705845,医療法人社団弘堂会 高田馬場駅前デンタルクリニック,"歯科, 矯正歯科",https://byoinnavi.jp/clinic/182797
千代田区,外神田２丁目,-,東京都千代田区外神田2丁目13-6 高井ビル1階,35.70216,139.769174,さくら歯科クリニック,歯科,https://byoinnavi.jp/clinic/179899
新宿区,西新宿１丁目,-,東京都新宿区西新宿1丁目13-8 朝日新宿ビル3F,35.689587,139.696772,医療法人スワン会 新宿スワン歯科・矯正歯科,"歯科, 矯正歯科, 小児歯科, 歯科口腔外科",https://byoinnavi.jp/clinic/5617
千代田区,内神田３丁目,-,東京都千代田区内神田3丁目10-1 大木ビル,35.691184,139.769402,吉田歯科医院,歯科,https://byoinnavi.jp/clinic/1920
新宿区,西新宿６丁目,-,東京都新宿区西新宿6丁目5-1 アイランドタワー2階,35.693106,139.693072,医療法人社団隆美会 川口歯科診療所,"歯科, 矯正歯科, 歯科口腔外科",https://byoinnavi.jp/clinic/5614
千代田区,九段南３丁目,-,東京都千代田区九段南三丁目5-2 宝ハウス2F,35.692408,139.742918,国光歯科医院,歯科,https://byoinnavi.jp/clinic/122448
千代田区,麹町３丁目,-,東京都千代田区麹町3丁目4-7 啓ビル8階,35.684436,139.737705,上條歯科医院,歯科,https://byoinnavi.jp/clinic/122444
新宿区,信濃町,-,東京都新宿区信濃町8 外苑北SRCビル3F,35.682619,139.71929,医療法人社団歯友会 赤羽歯科 信濃町診療所,"歯科, 矯正歯科, 小児歯科, 歯科口腔外科",https://byoinnavi.jp/clinic/4027
新宿区,市谷田町１丁目,-,東京都新宿区市谷田町1丁目1 ATビル3F,35.692463,139.735271,おざわ歯科医院,"歯科, 矯正歯科, 小児歯科",https://byoinnavi.jp/clinic/4259
新宿区,西新宿６丁目,-,東京都新宿区西新宿6丁目21-1 アイタウンプラザ2F,35.693559,139.687837,医療法人社団AMC アイタウンプラザデンタルオフィス,"歯科, 矯正歯科",https://byoinnavi.jp/clinic/5675
新宿区,新宿７丁目,-,東京都新宿区新宿7丁目27-9 リブレ東新宿1F,35.698645,139.707971,医療法人社団伸永会 東新宿歯科,"歯科, 矯正歯科, 小児歯科, 歯科口腔外科",https://byoinnavi.jp/clinic/181620
新宿区,新宿４丁目,-,東京都新宿区新宿4丁目3-22 安藤ビル5階,35.689435,139.704077,医療法人社団真歯会 常盤矯正歯科医院,矯正歯科,https://byoinnavi.jp/clinic/5516
新宿区,新宿３丁目,-,東京都新宿区新宿3丁目17-7 紀伊国屋ビル9階,35.692423,139.703102,医療法人社団和廣会 むさしの歯科,"歯科, 小児歯科, 歯科口腔外科",https://byoinnavi.jp/clinic/5485
新宿区,新宿４丁目,-,東京都新宿区新宿四丁目2-1 ライオンズマンション新宿御苑1F,35.688535,139.703041,医療法人社団幸橙会 新宿オランジェ歯科・矯正歯科,"歯科, 矯正歯科",https://byoinnavi.jp/clinic/6078
新宿区,新宿２丁目,-,東京都新宿区新宿2丁目1-2 白鳥ビル2階,35.688366,139.709504,新宿御苑前メンタルクリニック,"心療内科, 精神科",https://byoinnavi.jp/clinic/272691
新宿区,上落合２丁目,-,東京都新宿区上落合2-11-16,35.711996,139.689591,落合ファミリークリニック,"内科, 小児科",https://byoinnavi.jp/clinic/267504
新宿区,西新宿２丁目,-,東京都新宿区西新宿2丁目1-1 新宿三井ビル4F・5F,35.691882,139.693917,医療法人社団榊原厚生会 新宿三井ビルクリニック,"内科, 呼吸器科, 消化器科, 循環器科, 皮膚科, 婦人科, 糖尿病内科, 乳腺外科",https://byoinnavi.jp/clinic/4142
新宿区,西新宿１丁目,-,東京都新宿区西新宿1-3-17 新宿第1アオイビル9F,35.693376,139.698658,新宿駅前さくらレディースクリニック,"産婦人科, 婦人科, 美容皮膚科, 性感染症婦人科",https://byoinnavi.jp/clinic/271894
新宿区,左門町,-,東京都新宿区左門町20番地 四谷メディカルビル2F,35.684714,139.720323,四谷甲状腺クリニック,"内分泌内科, 糖尿病内科",https://byoinnavi.jp/clinic/271607
新宿区,新宿３丁目,-,東京都新宿区新宿3-24-3 新宿アルタ3F,35.692701,139.701327,新宿駅前ひまわりレディースクリニック,"産婦人科, 婦人科",https://byoinnavi.jp/clinic/275111
新宿区,四谷２丁目,-,東京都新宿区四谷2丁目4-1 ルネ四谷ビル1F,35.686627,139.726428,プラム四谷歯科クリニック,歯科,https://byoinnavi.jp/clinic/181617
新宿区,西新宿７丁目,-,東京都新宿区西新宿7-10-1 O-GUARDSHINJUKU5階,35.693909,139.698755,医療法人社団 東京桜十字 新宿桜十字クリニック,"内科, 消化器内科",https://byoinnavi.jp/clinic/272867
新宿区,西新宿１丁目,-,東京都新宿区西新宿1-18-17 ラウンドクロス西新宿8階,35.68899,139.698583,新宿西口耳鼻いんこう科・形成外科,"耳鼻いんこう科, 形成外科",https://byoinnavi.jp/clinic/174968
新宿区,富久町,-,東京都新宿区富久町17番2号 富久クロス1階,35.692599,139.71327,新宿トミヒサクロス クリニック,"内科, 消化器内科, 内視鏡内科, 肝臓内科, 糖尿病内科, 胃腸科",https://byoinnavi.jp/clinic/259311
新宿区,新宿２丁目,-,東京都新宿区新宿2-12-4 アコード新宿 8階,35.690599,139.707365,新宿ペリカンこころクリニック,"心療内科, 精神科",https://byoinnavi.jp/clinic/272487
新宿区,水道町,-,東京都新宿区水道町4-13 三晃ビル3F,35.708509,139.736165,いやま眼科,眼科,https://byoinnavi.jp/clinic/273108
新宿区,西新宿７丁目,-,東京都新宿区西新宿7丁目21-7 今野ビル,35.694398,139.694741,今野整形外科内科,"整形外科, 内科, リハビリテーション科",https://byoinnavi.jp/clinic/4069
新宿区,西新宿２丁目,-,東京都新宿区西新宿2-4-1 新宿NSビル4F,35.688188,139.693745,医療法人社団榊原厚生会 新宿NSビルクリニック,"内科, 消化器内科, 循環器科",https://byoinnavi.jp/clinic/5715
新宿区,西新宿４丁目,-,東京都新宿区西新宿4-2-18 武居西新宿ビル3F,35.690526,139.686403,西新宿5丁目駅前眼科,眼科,https://byoinnavi.jp/clinic/5558
新宿区,若松町,-,東京都新宿区若松町15-10,35.698037,139.714495,ミヤモト・クリニック・フォア・ウーメン,"産婦人科, 婦人科",https://byoinnavi.jp/clinic/3401
新宿区,西新宿１丁目,-,東京都新宿区西新宿1丁目3-13,35.693365,139.698111,カラサワ歯科クリニック,"歯科, 矯正歯科",https://byoinnavi.jp/clinic/5607
千代田区,鍛冶町２丁目,-,東京都千代田区鍛冶町二丁目7-2 後藤ビル7F,35.692322,139.771713,神田美容外科形成外科医院,"形成外科, 美容外科",https://byoinnavi.jp/clinic/18
千代田区,鍛冶町１丁目,-,東京都千代田区鍛冶町1丁目8-1 千代田SRビル2階,35.6908,139.772321,医療法人社団三貴会 クリニカ神田,耳鼻いんこう科,https://byoinnavi.jp/clinic/996
新宿区,富久町,-,東京都新宿区富久町17-2,35.692599,139.71327,医療法人社団因幡会 トミヒサクロスデンタルクリニック新宿御苑,歯科,https://byoinnavi.jp/clinic/261096
新宿区,百人町１丁目,-,東京都新宿区百人町1丁目18-10 第2林ビル2階,35.701631,139.695905,医療法人社団開成会 新宿大久保歯科医院,"歯科, 矯正歯科, 小児歯科, 歯科口腔外科",https://byoinnavi.jp/clinic/181621
千代田区,麹町４丁目,-,東京都千代田区麹町4丁目4-6 麹町4丁目小倉ビル7F,35.684233,139.735202,佐々木歯科医院,歯科,https://byoinnavi.jp/clinic/122442
新宿区,四谷１丁目,-,東京都新宿区四谷1丁目4 綿半野原ビル3F,35.686639,139.729375,医療法人社団 林歯科医院,歯科,https://byoinnavi.jp/clinic/4060
千代田区,外神田６丁目,-,東京都千代田区外神田6丁目3-8 外神田田島ビル2階,35.703138,139.769127,外神田歯科,歯科,https://byoinnavi.jp/clinic/177571
新宿区,西落合３丁目,-,東京都新宿区西落合三丁目1-2 コスモ西落合1F,35.72285,139.683375,MODOON DENTAL,"歯科, 歯科口腔外科",https://byoinnavi.jp/clinic/258893
千代田区,鍛冶町１丁目,-,東京都千代田区鍛冶町1丁目8-1 SRビル4階,35.6908,139.772321,佐藤歯科医院,歯科,https://byoinnavi.jp/clinic/122436
千代田区,神田三崎町３丁目,-,東京都千代田区神田三崎町3丁目4-,35.700879,139.752192,かい歯科医院,"歯科, 矯正歯科",https://byoinnavi.jp/clinic/5851
新宿区,市谷本村町,-,東京都新宿区市谷本村町3-19 千代田ビル1F,35.690805,139.731069,市ケ谷防衛省前歯科クリニック,"歯科, 矯正歯科, 小児歯科, 歯科口腔外科",https://byoinnavi.jp/clinic/259239
千代田区,飯田橋３丁目,-,東京都千代田区飯田橋3丁目11-20 山田ラインビルⅡ 2階,35.702732,139.747025,おおたき循環器内科クリニック,"内科, 循環器内科",https://byoinnavi.jp/clinic/4316
千代田区,神田錦町３丁目,-,東京都千代田区神田錦町3丁目22-2,35.693736,139.760558,医療法人社団田村会 田村歯科医院,歯科,https://byoinnavi.jp/clinic/18307
新宿区,四谷本塩町,-,東京都新宿区四谷1丁目6-1 コモレ四谷208,35.6874,139.729236,コモレ四谷デンタル,歯科,https://byoinnavi.jp/clinic/276965
千代田区,神田錦町３丁目,-,東京都千代田区神田錦町3丁目16 香村ビル5階,35.69355,139.761514,ライフ千代田クリニック,内科,https://byoinnavi.jp/clinic/178760
千代田区,隼町,-,東京都千代田区隼町3-19 隼町MTビル2階,35.682237,139.741996,風の木クリニック,"心療内科, 精神科",https://byoinnavi.jp/clinic/1181
千代田区,神田駿河台２丁目,-,東京都千代田区神田駿河台2丁目3-13 鈴木ビル1階,35.701093,139.759741,医療法人社団白群会 吉岡デンタルオフィス,歯科,https://byoinnavi.jp/clinic/178961
千代田区,外神田２丁目,-,東京都千代田区外神田2丁目18-3 第2昭和ビル1F,35.70206,139.766424,デンタルオフィス聖橋,"歯科, 矯正歯科, 小児歯科, 歯科口腔外科",https://byoinnavi.jp/clinic/6615
新宿区,中落合１丁目,-,東京都新宿区中落合1丁目14-4,35.716168,139.688577,栗原歯科医院,"歯科, 矯正歯科, 小児歯科, 歯科口腔外科",https://byoinnavi.jp/clinic/122568
新宿区,神楽坂３丁目,-,東京都新宿区神楽坂3丁目6 神楽坂サムライ堂ビル,35.700965,139.740137,医療法人社団康志会 神楽坂わたなべ歯科クリニック,"歯科, 矯正歯科, 小児歯科, 歯科口腔外科",https://byoinnavi.jp/clinic/258914
新宿区,下落合４丁目,-,東京都新宿区下落合4丁目23-12,35.721787,139.695349,さとう歯科クリニック,"歯科, 小児歯科, 歯科口腔外科",https://byoinnavi.jp/clinic/4881
新宿区,四谷三栄町,-,東京都新宿区四谷四谷三栄町12-7 N・Nビル1F,35.688958,139.724792,四ツ谷デンタルオフィス,"歯科, 矯正歯科, 小児歯科, 歯科口腔外科",https://byoinnavi.jp/clinic/272352
新宿区,新宿３丁目,-,東京都新宿区新宿3丁目13-5 クリハシビル8階,35.692176,139.705902,新宿三丁目北歯科,"歯科, 矯正歯科, 歯科口腔外科",https://byoinnavi.jp/clinic/4616
新宿区,西新宿１丁目,-,東京都新宿区西新宿1丁目23-1 TK新都心ビル5F,35.689935,139.696169,タカベデンタルクリニック,"歯科, 矯正歯科, 小児歯科",https://byoinnavi.jp/clinic/5604
