指標名,保育園,,,認可保育所,https://www.fukushihoken.metro.tokyo.lg.jp/kiban/fukushi_shisetsu/shs_list/shisetsuitiran.html,,,,
江東区,有明１丁目,-,江東区有明１－３－１,35.638781,139.790132,キッズスマイル江東有明,認可,58,2021年10月1日時点
江東区,富岡１丁目,-,江東区富岡１－４－１０－１Ｆ,35.670505,139.797849,富岡クローバー保育園,認可,46,2021年10月1日時点
江東区,亀戸６丁目,-,江東区亀戸６－５４－２－１０１,35.696525,139.832462,江東区亀戸保育園,認可,72,2021年10月1日時点
江東区,亀戸７丁目,-,江東区亀戸７－４１－１６　江東区青少年交流プラザ３・４階,35.696776,139.837388,江東区亀戸第二保育園,認可,103,2021年10月1日時点
江東区,亀戸１丁目,-,江東区亀戸１－２４－６,35.694531,139.824046,江東区亀戸第三保育園,認可,135,2021年10月1日時点
江東区,亀戸４丁目,-,江東区亀戸４－２１－１３,35.702639,139.826584,江東区亀戸第四保育園,認可,131,2021年10月1日時点
江東区,亀戸２丁目,-,江東区亀戸２－６－２－１０２号,35.700170,139.822557,陽だまり保育園,認可,80,2021年10月1日時点
江東区,亀戸４丁目,-,江東区亀戸４－１３－１８,35.700941,139.828180,アンジェリカ亀戸保育園,認可,78,2021年10月1日時点
江東区,亀戸６丁目,-,江東区亀戸６－５３－１１,35.695916,139.832650,コビープリスクールかめいど,認可,46,2021年10月1日時点
江東区,亀戸９丁目,-,江東区亀戸９－３４－１－１４０号,35.700283,139.840446,亀戸こころ保育園,認可,136,2021年10月1日時点
江東区,亀戸９丁目,-,江東区亀戸９－３６－１０,35.698439,139.838956,亀戸浅間保育園,認可,80,2021年10月1日時点
江東区,亀戸５丁目,-,江東区亀戸５－１－１５,35.697896,139.832286,グローバルキッズ亀戸園,認可,121,2021年10月1日時点
江東区,亀戸７丁目,-,江東区亀戸７－１０－１　１階,35.697658,139.834213,まなびの森保育園亀戸,認可,80,2021年10月1日時点
江東区,亀戸７丁目,-,江東区亀戸７－３９－２８,35.696654,139.839444,江東亀戸サテライトグローバルキッズ竪川園,認可,198,2021年10月1日時点
江東区,亀戸２丁目,-,江東区亀戸２－１０－１０,35.700341,139.823100,クオリスキッズ亀戸保育園,認可,80,2021年10月1日時点
江東区,亀戸７丁目,-,江東区亀戸７－３８－１２　１・２階,35.697506,139.839351,保育園ミルキーウェイ亀戸園,認可,52,2021年10月1日時点
江東区,亀戸６丁目,-,江東区亀戸６－４２－１３,35.696339,139.831974,こころこうとう保育園,認可,92,2021年10月1日時点
江東区,亀戸１丁目,-,江東区亀戸１－４３－８　１階,35.696675,139.820766,おはよう保育園　亀戸,認可,45,2021年10月1日時点
江東区,亀戸３丁目,-,江東区亀戸３－４３－２３,35.703735,139.822001,にじいろ保育園亀戸,認可,79,2021年10月1日時点
江東区,大島９丁目,-,江東区大島９－７－８－１０１,35.694046,139.844188,江東区わかば保育園,認可,112,2021年10月1日時点
江東区,大島５丁目,-,江東区大島５－４０－４　１階,35.687026,139.837178,江東区大島保育園,認可,98,2021年10月1日時点
江東区,大島４丁目,-,江東区大島４－１－６－１３０,35.687428,139.830089,江東区大島第二保育園,認可,92,2021年10月1日時点
江東区,大島６丁目,-,江東区大島６－１－６－１３０,35.692341,139.833261,江東区大島第三保育園,認可,101,2021年10月1日時点
江東区,大島８丁目,-,江東区大島８－１２－２０－１０１,35.687331,139.839009,江東区大島第四保育園,認可,99,2021年10月1日時点
江東区,大島４丁目,-,江東区大島４－２１－３－１０１,35.686485,139.831799,江東区大島第五保育園,認可,105,2021年10月1日時点
江東区,大島２丁目,-,江東区大島２－３６－１５,35.691557,139.825282,マミー保育園西大島,認可,60,2021年10月1日時点
江東区,大島３丁目,-,江東区大島３－８－７,35.692453,139.828276,花と鳥保育園,認可,90,2021年10月1日時点
江東区,大島７丁目,-,江東区大島７－３７－１３,35.691958,139.841564,かがやき保育園,認可,161,2021年10月1日時点
江東区,大島１丁目,-,江東区大島１－１０－５,35.688712,139.823399,グローバルキッズ西大島園,認可,73,2021年10月1日時点
江東区,大島６丁目,-,江東区大島６－２２－８,35.692938,139.837237,ココロラボインターナショナル大島,認可,56,2021年10月1日時点
江東区,大島５丁目,-,江東区大島５－２７－１３,35.686747,139.835882,太陽の子　大島五丁目保育園,認可,78,2021年10月1日時点
江東区,大島３丁目,-,江東区大島３－１４－５　１階,35.689826,139.828118,プチ・ナーサリー西大島,認可,60,2021年10月1日時点
江東区,大島６丁目,-,江東区大島６－２６－１１,35.691102,139.837016,キッズスマイル江東大島,認可,60,2021年10月1日時点
江東区,大島３丁目,-,江東区大島３－１５－１０,35.690609,139.828836,大島なかよし保育園,認可,45,2021年10月1日時点
江東区,大島５丁目,-,江東区大島５－３０－１２,35.687737,139.835003,京進のほいくえん　ビーフェアおおじまタウン,認可,60,2021年10月1日時点
江東区,大島８丁目,-,江東区大島８－３１－２,35.688990,139.842110,アスク東大島保育園,認可,70,2021年10月1日時点
江東区,北砂５丁目,-,江東区北砂１－１－４－１０１,35.682403,139.831695,江東区北砂保育園,認可,100,2021年10月1日時点
江東区,北砂１丁目,-,江東区北砂１－３－３０,35.684136,139.823684,江東区小名木川保育園,認可,140,2021年10月1日時点
江東区,北砂５丁目,-,江東区北砂５－２０－３－１０１,35.682307,139.832035,江東区小名木川第二保育園,認可,122,2021年10月1日時点
江東区,北砂５丁目,-,江東区北砂５－２０－９－１０１,35.684801,139.833006,江東区亀高保育園,認可,111,2021年10月1日時点
江東区,北砂５丁目,-,江東区北砂５－２０－１０－１０１,35.685559,139.833809,江東区亀高第二保育園,認可,110,2021年10月1日時点
江東区,北砂５丁目,-,江東区北砂４－１８－２７,35.682403,139.831695,砂町保育園,認可,100,2021年10月1日時点
江東区,北砂５丁目,-,江東区北砂５－１４－１０,35.680734,139.834512,砂町友愛園,認可,100,2021年10月1日時点
江東区,北砂５丁目,-,江東区北砂１－９－６,35.682403,139.831695,スクルドエンジェル北砂園,認可,73,2021年10月1日時点
江東区,北砂５丁目,-,江東区北砂５－１－２８,35.679963,139.832414,Ｍｉｌｋｙ　Ｗａｙ　Ｉｎｔｅｒｎａｔｉｏｎａｌ　Ｎｕｒｓｅｒｙ　Ｓｃｈｏｏｌ　北砂校,認可,69,2021年10月1日時点
江東区,北砂５丁目,-,江東区北砂５－１７－５,35.682068,139.834313,にじいろ保育園北砂,認可,69,2021年10月1日時点
江東区,北砂５丁目,-,江東区北砂５－１－２３,35.680220,139.832834,キッズスマイル江東北砂,認可,85,2021年10月1日時点
江東区,北砂５丁目,-,江東区北砂６－２７－１９,35.682403,139.831695,みらいく北砂園,認可,63,2021年10月1日時点
江東区,東砂５丁目,-,江東区東砂２－１３－２－１０１,35.677307,139.841930,江東区東砂保育園,認可,80,2021年10月1日時点
江東区,東砂２丁目,-,江東区東砂２－６－４－１０１,35.684457,139.842979,江東区東砂第二保育園,認可,84,2021年10月1日時点
江東区,東砂５丁目,-,江東区東砂１－５－３－１０１,35.677307,139.841930,江東区東砂第三保育園,認可,103,2021年10月1日時点
江東区,東砂５丁目,-,江東区東砂７－１７－３５－１０１,35.677307,139.841930,江東区東砂第四保育園,認可,92,2021年10月1日時点
江東区,東砂６丁目,-,江東区東砂６－２－１６,35.669828,139.841543,ともしび保育園,認可,110,2021年10月1日時点
江東区,東砂３丁目,-,江東区東砂３－３０－１１,35.680994,139.844492,みらいく東砂園,認可,60,2021年10月1日時点
江東区,東砂５丁目,-,江東区東砂３－２８－１,35.677307,139.841930,マミー保育園東砂,認可,150,2021年10月1日時点
江東区,東砂７丁目,-,江東区東砂７－１８－１８,35.675280,139.837739,にじいろ保育園東砂,認可,100,2021年10月1日時点
江東区,東砂８丁目,-,江東区東砂８－１９－４,35.667701,139.841610,キッズスマイル江東東砂,認可,58,2021年10月1日時点
江東区,新砂３丁目,-,江東区新砂３－３－１１,35.659429,139.831695,江東区新砂保育園,認可,119,2021年10月1日時点
江東区,南砂３丁目,-,江東区南砂４－４－１－１０２,35.672828,139.827857,江東区南砂第一保育園,認可,97,2021年10月1日時点
江東区,南砂２丁目,-,江東区南砂２－３－３－１０２,35.673170,139.823004,江東区南砂第三保育園,認可,104,2021年10月1日時点
江東区,南砂２丁目,-,江東区南砂２－３－４－１０１,35.671798,139.823245,江東区南砂第四保育園,認可,111,2021年10月1日時点
江東区,南砂２丁目,-,江東区南砂２－３－６－１０３,35.670193,139.823849,江東区南砂第五保育園,認可,70,2021年10月1日時点
江東区,南砂７丁目,-,江東区南砂７－９－１１,35.669867,139.835156,江東区城東保育園,認可,119,2021年10月1日時点
江東区,南砂２丁目,-,江東区南砂２－３－１－１０１号,35.670288,139.822001,江東区南砂第二保育園,認可,109,2021年10月1日時点
江東区,南砂６丁目,-,江東区南砂６－８－３,35.671211,139.834853,江東区南砂さくら保育園,認可,100,2021年10月1日時点
江東区,南砂３丁目,-,江東区南砂３－１０－８,35.670060,139.830469,南砂町保育園,認可,90,2021年10月1日時点
江東区,南砂７丁目,-,江東区南砂７－１４－１７,35.668907,139.837783,八幡保育園,認可,65,2021年10月1日時点
江東区,南砂４丁目,-,江東区南砂４－１８－４　１・２階,35.672965,139.832479,ルーチェ保育園　南砂,認可,60,2021年10月1日時点
江東区,南砂２丁目,-,江東区南砂２－３６－１０,35.672320,139.825845,太陽の子　南砂２丁目保育園,認可,90,2021年10月1日時点
江東区,南砂６丁目,-,江東区南砂６－１０－１１,35.670636,139.835577,おはよう保育園　南砂町,認可,80,2021年10月1日時点
江東区,南砂３丁目,-,江東区南砂３－１４－６,35.670138,139.832883,グローバルキッズ南砂園,認可,99,2021年10月1日時点
江東区,南砂２丁目,-,江東区南砂２－２８－２７,35.675431,139.821666,ドリームキッズランド保育園,認可,55,2021年10月1日時点
江東区,南砂２丁目,-,江東区南砂２－２－１１,35.669609,139.823522,南砂あら川保育園,認可,63,2021年10月1日時点
品川区,北品川２丁目,-,品川区北品川２－７－２１,35.618862,139.743947,北品川保育園,認可,78,2021年10月1日時点
品川区,北品川３丁目,-,品川区北品川１－２８－１０,35.620918,139.738379,さくらさくみらい　北品川,認可,63,2021年10月1日時点
品川区,北品川３丁目,-,品川区北品川１－１６－４,35.620918,139.738379,ひがしやつやま保育園,認可,60,2021年10月1日時点
品川区,北品川３丁目,-,品川区北品川３－６－１,35.620429,139.739276,さくらさくみらい　御殿山,認可,61,2021年10月1日時点
品川区,東品川２丁目,-,品川区東品川１－８－３０,35.619148,139.751153,台場保育園,認可,116,2021年10月1日時点
品川区,東品川２丁目,-,品川区東品川１－３４－９,35.619148,139.751153,東品川保育園,認可,107,2021年10月1日時点
品川区,東品川２丁目,-,品川区東品川１－２－１５,35.619148,139.751153,八ツ山保育園,認可,63,2021年10月1日時点
品川区,東品川２丁目,-,品川区東品川４－８－８,35.619148,139.751153,アンジェリカ東品川保育園,認可,90,2021年10月1日時点
品川区,東品川２丁目,-,品川区東品川３－２１－１０,35.619148,139.751153,みずなら保育園,認可,82,2021年10月1日時点
品川区,東品川４丁目,-,品川区東品川４－８－８　２Ｆ,35.609461,139.745846,青物横丁えほん保育園,認可,80,2021年10月1日時点
品川区,東品川２丁目,-,品川区東品川１－３６－１１,35.619148,139.751153,アイ保育園,認可,60,2021年10月1日時点
品川区,東品川２丁目,-,品川区東品川４－１１－３６,35.619148,139.751153,まなびの森保育園品川シーサイド,認可,80,2021年10月1日時点
品川区,東品川２丁目,-,品川区東品川３－２５－９,35.619148,139.751153,ほっぺるランド東品川,認可,72,2021年10月1日時点
品川区,東品川２丁目,-,品川区東品川３－２６－２１,35.619148,139.751153,みらいく東品川園,認可,60,2021年10月1日時点
品川区,東品川２丁目,-,品川区東品川４－９－２０,35.619148,139.751153,さくらさくみらい　東品川,認可,70,2021年10月1日時点
品川区,八潮５丁目,-,品川区八潮５－１－３,35.604708,139.752998,八潮北保育園,認可,102,2021年10月1日時点
品川区,八潮５丁目,-,品川区八潮５－４－１６,35.601516,139.750986,八潮西保育園,認可,100,2021年10月1日時点
品川区,八潮５丁目,-,品川区八潮５－６－３２,35.596297,139.749755,八潮南保育園,認可,97,2021年10月1日時点
品川区,八潮５丁目,-,品川区八潮５－１０－６０－１０１,35.599365,139.751328,八潮中央保育園,認可,90,2021年10月1日時点
品川区,南品川５丁目,-,品川区南品川１－２－１１,35.612755,139.740933,とうかいどう保育園,認可,99,2021年10月1日時点
品川区,南品川２丁目,-,品川区南品川２－９－１３,35.614133,139.742787,どんぐり保育園,認可,128,2021年10月1日時点
品川区,南品川５丁目,-,品川区南品川５－３－１０,35.611631,139.741684,太陽の子南品川保育園,認可,80,2021年10月1日時点
品川区,南品川４丁目,-,品川区南品川４－１－１１,35.614515,139.738160,くりのき保育園,認可,90,2021年10月1日時点
品川区,南品川５丁目,-,品川区南品川６－３－４,35.612755,139.740933,こころしながわおおいまち保育園,認可,97,2021年10月1日時点
品川区,南品川２丁目,-,品川区南品川２－１５－６,35.614075,139.744677,なぎさ通り保育園,認可,67,2021年10月1日時点
品川区,南品川５丁目,-,品川区南品川６－１５－２２,35.612755,139.740933,さんさん森の保育園大井町,認可,99,2021年10月1日時点
品川区,大井６丁目,-,品川区東大井６－１４－１６,35.596148,139.732412,大井保育園,認可,131,2021年10月1日時点
品川区,大井５丁目,-,品川区東大井５－８－１２,35.599505,139.730356,品川保育園,認可,145,2021年10月1日時点
品川区,大井３丁目,-,品川区東大井３－４－４,35.603589,139.731959,東大井保育園,認可,100,2021年10月1日時点
品川区,大井３丁目,-,品川区東大井３－１８－２,35.601590,139.729917,アンジェリカはまかわ保育園,認可,90,2021年10月1日時点
品川区,大井２丁目,-,品川区東大井２－１１－４,35.605449,139.730248,さくらさくみらい　東大井,認可,64,2021年10月1日時点
品川区,大井４丁目,-,品川区東大井４－１２－１１,35.601961,139.733280,みらいく東大井園,認可,60,2021年10月1日時点
品川区,大井５丁目,-,品川区東大井５－２１－９,35.597637,139.729927,大井町えほん保育園,認可,73,2021年10月1日時点
品川区,大井１丁目,-,品川区東大井１－３－６,35.607171,139.733988,こころしながわひがしおおい保育園,認可,90,2021年10月1日時点
品川区,大井３丁目,-,品川区東大井３－１－１１,35.603577,139.729927,アソシエ東大井公園保育園,認可,69,2021年10月1日時点
品川区,勝島１丁目,-,品川区勝島１－６－５,35.597714,139.744456,ポピンズナーサリースクール勝島,認可,60,2021年10月1日時点
品川区,勝島１丁目,-,品川区勝島１－６－３２,35.596166,139.743656,えがおの森保育園・かつしま,認可,73,2021年10月1日時点
品川区,勝島３丁目,-,品川区勝島３－２－２,35.592980,139.738947,にじいろ保育園勝島,認可,92,2021年10月1日時点
品川区,大井６丁目,-,品川区南大井６－２－１５,35.597822,139.732870,水神保育園,認可,107,2021年10月1日時点
品川区,大井３丁目,-,品川区南大井３－７－４,35.602867,139.730236,南大井保育園,認可,100,2021年10月1日時点
品川区,南大井６丁目,-,品川区南大井６－２２－７　大森ベルポートＥ館１Ｆ,35.589186,139.732192,アスク南大井保育園,認可,90,2021年10月1日時点
品川区,大井６丁目,-,品川区南大井６－１６－１６,35.595365,139.731534,大空と大地のなーさりぃ大森駅前園,認可,80,2021年10月1日時点
品川区,南大井６丁目,-,品川区南大井６－２６－２　Ｂ館１Ｆ,35.588164,139.731514,キッズガーデン南大井,認可,90,2021年10月1日時点
品川区,大井１丁目,-,品川区南大井１－１６－６,35.607461,139.730236,にじいろ保育園南大井,認可,72,2021年10月1日時点
品川区,大井４丁目,-,品川区大井４－１１－８,35.602174,139.734218,大井倉田保育園,認可,110,2021年10月1日時点
品川区,大井５丁目,-,品川区大井５－１８－１,35.598079,139.727728,滝王子保育園,認可,80,2021年10月1日時点
品川区,大井７丁目,-,品川区大井７－４－１８,35.596483,139.729219,緑の家保育園,認可,70,2021年10月1日時点
品川区,大井１丁目,-,品川区大井１－１６－２,35.607787,139.730460,あいのもり保育園,認可,60,2021年10月1日時点
品川区,大井１丁目,-,品川区大井１－３１－１　シティタワー大井町１階,35.605500,139.730833,しなおおコスモ保育園,認可,69,2021年10月1日時点
品川区,大井３丁目,-,品川区大井３－２６－７,35.600728,139.730496,クオリスキッズ大井町第２保育園,認可,60,2021年10月1日時点
品川区,大井３丁目,-,品川区大井３－１７－１１,35.601706,139.731055,クオリスキッズ大井町保育園,認可,60,2021年10月1日時点
品川区,西大井４丁目,-,品川区西大井６－１３－１,35.597670,139.720499,伊藤保育園,認可,100,2021年10月1日時点
品川区,西大井４丁目,-,品川区西大井１－１－１,35.597670,139.720499,西大井保育園,認可,116,2021年10月1日時点
品川区,西大井４丁目,-,品川区西大井６－１－１５,35.597670,139.720499,冨士見台保育園,認可,120,2021年10月1日時点
品川区,西大井２丁目,-,品川区西大井２－５－２１,35.599172,139.722256,キッズタウンにしおおい,認可,100,2021年10月1日時点
品川区,西大井４丁目,-,品川区西大井６－６－２,35.597670,139.720499,グローバルキッズ西大井園,認可,86,2021年10月1日時点
品川区,西大井４丁目,-,品川区西大井４－１９－１１,35.593908,139.719206,みどりの丘保育園,認可,68,2021年10月1日時点
品川区,西大井４丁目,-,品川区西大井１－４－１,35.597670,139.720499,まなびの森保育園西大井,認可,100,2021年10月1日時点
品川区,西大井４丁目,-,品川区西大井６－７－１,35.597670,139.720499,西大井えほん保育園,認可,80,2021年10月1日時点
品川区,北品川３丁目,-,品川区北品川５－９－１５,35.620918,139.738379,グローバルキッズ大崎園,認可,60,2021年10月1日時点
品川区,北品川３丁目,-,品川区北品川５－３－１,35.620918,139.738379,品川区立五反田第二保育園,認可,50,2021年10月1日時点
品川区,北品川３丁目,-,品川区北品川６－７－２２,35.620918,139.738379,キッズガーデン北品川,認可,90,2021年10月1日時点
品川区,大崎３丁目,-,品川区上大崎３－１４－３５,35.617715,139.723771,ＴＫチルドレンズファーム上大崎校,認可,60,2021年10月1日時点
品川区,上大崎４丁目,-,品川区上大崎４－５－３７　本多電機ビル１・２階,35.628599,139.715569,キッズガーデン品川上大崎,認可,108,2021年10月1日時点
品川区,上大崎３丁目,-,品川区上大崎３－１－１　目黒セントラルスクエア３階,35.633410,139.716748,花房山目黒駅前保育園３３３,認可,120,2021年10月1日時点
品川区,東五反田５丁目,-,品川区東五反田５－２４－１,35.627980,139.723378,東五反田保育園,認可,78,2021年10月1日時点
品川区,東五反田１丁目,-,品川区東五反田１－２－２５,35.627836,139.727223,ほっぺるランド東五反田,認可,60,2021年10月1日時点
品川区,東五反田１丁目,-,品川区東五反田４－７－２０,35.627278,139.725607,大空と大地のなーさりぃ東五反田園,認可,108,2021年10月1日時点
品川区,西五反田７丁目,-,品川区西五反田３－９－１０,35.623568,139.719222,西五反田保育園,認可,79,2021年10月1日時点
品川区,西五反田７丁目,-,品川区西五反田６－５－６,35.623568,139.719222,西五反田第二保育園,認可,130,2021年10月1日時点
品川区,西五反田７丁目,-,品川区西五反田３－９－９,35.623568,139.719222,ぷりすくーる西五反田,認可,46,2021年10月1日時点
品川区,西五反田４丁目,-,品川区西五反田４－１１－１８,35.625710,139.708290,宝保育園,認可,88,2021年10月1日時点
品川区,西五反田１丁目,-,品川区西五反田１－２１－８,35.622972,139.723263,まなびの森保育園大崎広小路,認可,60,2021年10月1日時点
品川区,西五反田７丁目,-,品川区西五反田５－６－３８,35.623568,139.719222,こころしながわふどうまえ保育園,認可,97,2021年10月1日時点
品川区,西五反田８丁目,-,品川区西五反田８－１０－２１,35.619577,139.720320,キッズガーデン品川西五反田,認可,83,2021年10月1日時点
品川区,西五反田３丁目,-,品川区西五反田３－８－８,35.626434,139.717975,ウィズブック保育園西五反田,認可,101,2021年10月1日時点
品川区,西五反田３丁目,-,品川区西五反田３－１２－１２　２Ｆ,35.627280,139.714755,不動前えほん保育園,認可,73,2021年10月1日時点
品川区,西五反田７丁目,-,品川区西五反田７－１９－１　２Ｆ,35.623891,139.718502,太陽の子西五反田保育園,認可,60,2021年10月1日時点
品川区,西五反田１丁目,-,品川区西五反田１－２９－２　吾作ビル,35.624998,139.722115,キッズガーデン五反田駅前,認可,73,2021年10月1日時点
品川区,大崎５丁目,-,品川区大崎５－２－１,35.621897,139.726427,大崎保育園,認可,125,2021年10月1日時点
品川区,大崎３丁目,-,品川区大崎３－１－９,35.620842,139.724875,大崎ひまわり保育園,認可,70,2021年10月1日時点
品川区,大崎３丁目,-,品川区大崎３－６－３２,35.620440,139.726585,ココファン・ナーサリー大崎,認可,90,2021年10月1日時点
品川区,大崎５丁目,-,品川区大崎５－４－３　小野ビル１階,35.623111,139.725328,にじいろ保育園大崎,認可,60,2021年10月1日時点
品川区,大崎４丁目,-,品川区大崎４－１－２　ウィン第２五反田ビル２Ｆ,35.622509,139.722933,ベネッセ大崎広小路保育園,認可,88,2021年10月1日時点
品川区,西品川２丁目,-,品川区西品川３－１６－３５,35.614523,139.728161,西品川保育園,認可,147,2021年10月1日時点
品川区,豊町２丁目,-,品川区豊町２－１－３０,35.610639,139.722938,三ツ木保育園,認可,80,2021年10月1日時点
品川区,西品川２丁目,-,品川区西品川２－２２－２,35.612777,139.725378,キッズガーデン西品川,認可,60,2021年10月1日時点
品川区,西品川１丁目,-,品川区西品川１－２８－１４,35.609009,139.726625,そらのいろ保育園,認可,73,2021年10月1日時点
品川区,戸越５丁目,-,品川区戸越５－１４－２３,35.610557,139.715199,グローバルキッズ戸越園,認可,60,2021年10月1日時点
品川区,戸越４丁目,-,品川区戸越４－１－１０,35.612722,139.717945,東戸越保育園,認可,70,2021年10月1日時点
品川区,戸越４丁目,-,品川区戸越６－１５－５,35.612722,139.717945,キッズラボ中延園,認可,73,2021年10月1日時点
品川区,豊町１丁目,-,品川区豊町１－１８－１５,35.611535,139.722749,ゆたか保育園,認可,70,2021年10月1日時点
品川区,豊町２丁目,-,品川区豊町２－１６－１２,35.609430,139.725348,日本音楽学校保育園,認可,26,2021年10月1日時点
品川区,豊町５丁目,-,品川区豊町５－１３－１５,35.605169,139.720070,キッズガーデン品川豊町,認可,83,2021年10月1日時点
