指標名,保育園,,,認可保育所,https://www.fukushihoken.metro.tokyo.lg.jp/kiban/fukushi_shisetsu/shs_list/shisetsuitiran.html,,,,
品川区,豊町３丁目,-,品川区豊町３－５－３１,35.609007,139.720938,ほうさん保育園,認可,75,2021年10月1日時点
品川区,豊町４丁目,-,品川区豊町４－１７－２１,35.606500,139.720921,南ゆたか保育園,認可,107,2021年10月1日時点
品川区,豊町３丁目,-,品川区豊町３－２－１３,35.608136,139.719369,さんさん森の保育園戸越公園,認可,84,2021年10月1日時点
品川区,二葉１丁目,-,品川区二葉１－４－２５,35.607987,139.726673,二葉保育園,認可,63,2021年10月1日時点
品川区,二葉１丁目,-,品川区二葉１－３－４０,35.607037,139.725560,二葉つぼみ保育園,認可,66,2021年10月1日時点
品川区,二葉１丁目,-,品川区二葉１－１２－１８,35.606797,139.726801,大井町のぞみ保育園,認可,60,2021年10月1日時点
品川区,二葉４丁目,-,品川区二葉４－２－１３,35.602651,139.713816,こころしながわなかのぶ保育園,認可,94,2021年10月1日時点
品川区,二葉４丁目,-,品川区二葉４－３－８,35.602916,139.714723,はぐはぐキッズ二葉,認可,60,2021年10月1日時点
品川区,平塚２丁目,-,品川区平塚２－２－３,35.618787,139.717415,平塚保育園,認可,107,2021年10月1日時点
品川区,平塚２丁目,-,品川区平塚２－１８－１９,35.615453,139.713330,とごしの杜保育園,認可,108,2021年10月1日時点
品川区,平塚２丁目,-,品川区平塚２－１４－１,35.616652,139.713297,チャイルドマインダー平塚荏原,認可,80,2021年10月1日時点
品川区,東中延２丁目,-,品川区東中延２－５－１０,35.609207,139.713477,東中延保育園,認可,96,2021年10月1日時点
品川区,東中延２丁目,-,品川区東中延１－６－２,35.609207,139.713477,モニカ荏原中延園,認可,60,2021年10月1日時点
品川区,中延４丁目,-,品川区中延４－１４－１９,35.605055,139.710285,源氏前保育園,認可,113,2021年10月1日時点
品川区,中延４丁目,-,品川区中延５－２－１,35.605055,139.710285,グローバルキッズ荏原町保育園,認可,90,2021年10月1日時点
品川区,中延４丁目,-,品川区中延４－５－７,35.605055,139.710285,グローバルキッズ中延園,認可,60,2021年10月1日時点
品川区,中延４丁目,-,品川区中延６－１－１９,35.605055,139.710285,このえ中延保育園,認可,70,2021年10月1日時点
品川区,中延４丁目,-,品川区中延２－６－４,35.605055,139.710285,こころしながわえばら保育園,認可,107,2021年10月1日時点
品川区,西中延２丁目,-,品川区西中延１－６－１６,35.608623,139.707731,中延保育園,認可,126,2021年10月1日時点
品川区,西中延２丁目,-,品川区西中延３－８－５,35.608623,139.707731,西中延保育園,認可,83,2021年10月1日時点
品川区,小山台１丁目,-,品川区小山台１－３－８,35.625048,139.706818,小山台保育園,認可,93,2021年10月1日時点
品川区,小山台１丁目,-,品川区小山台１－２５－１０,35.621935,139.706732,チャイルドマインダー小山台東,認可,73,2021年10月1日時点
品川区,小山１丁目,-,品川区小山１－４－１,35.622123,139.712573,中原保育園,認可,96,2021年10月1日時点
品川区,小山４丁目,-,品川区小山４－４－７　コスモ武蔵小山ビル１・２階,35.618547,139.704309,ウィズブック保育園武蔵小山,認可,60,2021年10月1日時点
品川区,小山５丁目,-,品川区小山５－９－１６,35.616666,139.702845,こころしながわむさしこやま保育園,認可,101,2021年10月1日時点
品川区,小山４丁目,-,品川区小山４－１４－１０,35.617487,139.703044,ウィズブック保育園武蔵小山パルズ,認可,117,2021年10月1日時点
品川区,小山７丁目,-,品川区小山７－１１－６,35.610097,139.697941,キッズガーデン品川洗足,認可,73,2021年10月1日時点
品川区,小山３丁目,-,品川区小山３－１５－１　パークシティ武蔵小山　ザ　モール,35.620007,139.704194,ニチイキッズむさしこやま保育園,認可,30,2021年10月1日時点
品川区,小山４丁目,-,品川区小山４－３－９,35.618959,139.702934,品川大和保育園,認可,60,2021年10月1日時点
品川区,荏原２丁目,-,品川区荏原２－１６－１８,35.616654,139.709006,荏原保育園,認可,120,2021年10月1日時点
品川区,荏原４丁目,-,品川区荏原４－１６－１１,35.613887,139.706183,荏原西保育園,認可,100,2021年10月1日時点
品川区,荏原４丁目,-,品川区荏原４－５－２２,35.615070,139.707675,荏原西第二保育園,認可,88,2021年10月1日時点
品川区,荏原７丁目,-,品川区荏原７－８－３,35.611653,139.701542,清水台保育園,認可,100,2021年10月1日時点
品川区,荏原３丁目,-,品川区荏原３－１－１８,35.618135,139.707624,さくらさくみらい　武蔵小山,認可,70,2021年10月1日時点
品川区,荏原６丁目,-,品川区荏原６－１２－１５,35.612334,139.705757,ウィズブック保育園荏原,認可,89,2021年10月1日時点
品川区,旗の台３丁目,-,品川区旗の台３－２－９,35.605062,139.706814,みらいく旗の台園,認可,60,2021年10月1日時点
品川区,旗の台６丁目,-,品川区旗の台６－２９－１４,35.604793,139.698213,アソシエ旗の台保育園,認可,69,2021年10月1日時点
品川区,旗の台３丁目,-,品川区旗の台３－３－２０,35.605571,139.707224,ココファン・ナーサリー旗の台,認可,60,2021年10月1日時点
品川区,南大井１丁目,-,品川区南大井１－８－２３,35.596351,139.739481,グローバルキッズ立会川園,認可,60,2021年10月1日時点
品川区,小山３丁目,-,品川区小山３－７－１６,35.620503,139.706714,こどもヶ丘保育園小山園,認可,60,2021年10月1日時点
渋谷区,神宮前３丁目,-,渋谷区神宮前３－１８－８,35.671213,139.709966,渋谷保育園,認可,135,2021年10月1日時点
渋谷区,神宮前６丁目,-,渋谷区神宮前６－１０－１４,35.667528,139.705200,神宮前保育園にじ,認可,45,2021年10月1日時点
渋谷区,神宮前６丁目,-,渋谷区神宮前６－３４－２５,35.667567,139.702430,未来のカプセル原宿保育園,認可,39,2021年10月1日時点
渋谷区,渋谷１丁目,-,渋谷区渋谷１－１８－９,35.661791,139.704697,ベネッセ美竹の丘保育園,認可,64,2021年10月1日時点
渋谷区,東２丁目,-,渋谷区東２－２０－１８,35.653650,139.709110,氷川保育園,認可,64,2021年10月1日時点
渋谷区,東４丁目,-,渋谷区東４－７－８,35.655814,139.713098,渋谷東ちとせ保育園,認可,90,2021年10月1日時点
渋谷区,広尾５丁目,-,渋谷区広尾５－７－１,35.649261,139.722328,広尾保育園,認可,106,2021年10月1日時点
渋谷区,広尾４丁目,-,渋谷区広尾４－１－１,35.652864,139.719141,広尾上宮保育園,認可,100,2021年10月1日時点
渋谷区,広尾１丁目,-,渋谷区広尾１－３－１１,35.648763,139.712998,遍照広尾保育園,認可,108,2021年10月1日時点
渋谷区,恵比寿１丁目,-,渋谷区恵比寿１－２７－１０,35.647518,139.716410,新橋保育園,認可,112,2021年10月1日時点
渋谷区,恵比寿西２丁目,-,渋谷区恵比寿西２－８－１,35.649914,139.707232,恵比寿保育園,認可,108,2021年10月1日時点
渋谷区,恵比寿西２丁目,-,渋谷区恵比寿西２－１３－５,35.651108,139.705976,茶々だいかんやま保育園,認可,113,2021年10月1日時点
渋谷区,恵比寿南３丁目,-,渋谷区恵比寿南３－１１－２５,35.644686,139.706774,ポピンズナーサリースクール恵比寿南,認可,130,2021年10月1日時点
渋谷区,桜丘町,-,渋谷区桜丘町２３－２１,35.655458,139.699965,さくら上宮保育園,認可,70,2021年10月1日時点
渋谷区,鴬谷町,-,渋谷区鴬谷町２－１６,35.654035,139.704476,ほっぺるランド渋谷,認可,90,2021年10月1日時点
渋谷区,代官山町,-,渋谷区代官山町７－９,35.650728,139.705022,代官山保育園,認可,84,2021年10月1日時点
渋谷区,宇田川町,-,渋谷区宇田川町３８－４,35.662066,139.696003,渋谷もりのこ保育園神南,認可,103,2021年10月1日時点
渋谷区,松涛１丁目,-,渋谷区松濤１－２６－６,35.658986,139.693073,大向保育園,認可,98,2021年10月1日時点
渋谷区,千駄ケ谷３丁目,-,渋谷区千駄ヶ谷３－３４－９,35.677563,139.706976,千駄ケ谷保育園,認可,76,2021年10月1日時点
渋谷区,千駄ケ谷４丁目,-,渋谷区千駄ヶ谷４－２８－８,35.680914,139.703420,鳩の森保育園,認可,67,2021年10月1日時点
渋谷区,千駄ケ谷５丁目,-,渋谷区千駄ヶ谷５－２４－５５,35.688402,139.700698,キッズハーモニー・ＮＥＷｏＭａｎ,認可,39,2021年10月1日時点
渋谷区,千駄ケ谷３丁目,-,渋谷区千駄ヶ谷３－２１－５,35.677086,139.708830,美希保育園北参道,認可,80,2021年10月1日時点
渋谷区,千駄ケ谷５丁目,-,渋谷区千駄ヶ谷５－２７－５　リンクスクエア新宿２Ｆ,35.686527,139.702838,千駄ヶ谷りとるぱんぷきんず,認可,63,2021年10月1日時点
渋谷区,代々木３丁目,-,渋谷区代々木３－５１－８,35.681984,139.695977,代々木保育園,認可,95,2021年10月1日時点
渋谷区,代々木５丁目,-,渋谷区代々木５－１６－４,35.674721,139.688698,聖ヨゼフ保育園,認可,114,2021年10月1日時点
渋谷区,代々木２丁目,-,渋谷区代々木２－３５－１,35.684525,139.697932,キッズハーモニー・よよぎの杜,認可,199,2021年10月1日時点
渋谷区,代々木４丁目,-,渋谷区代々木４－５０－１３,35.678465,139.691506,参宮橋ちとせ保育園,認可,180,2021年10月1日時点
渋谷区,代々木４丁目,-,渋谷区代々木４－３７－１５,35.680830,139.689243,みんなのみらいをつくる保育園初台,認可,30,2021年10月1日時点
渋谷区,代々木４丁目,-,渋谷区代々木４－２７－６,35.682831,139.691318,太陽の子代々木西参道保育園,認可,131,2021年10月1日時点
渋谷区,代々木５丁目,-,渋谷区代々木５－７－２,35.669846,139.688625,グローバルキッズ代々木八幡園,認可,79,2021年10月1日時点
渋谷区,初台２丁目,-,渋谷区初台２－１７－２２,35.677547,139.684688,初台保育園,認可,117,2021年10月1日時点
渋谷区,初台２丁目,-,渋谷区初台２－１３－１１,35.676497,139.683384,ゆめの樹保育園はつだい,認可,71,2021年10月1日時点
渋谷区,初台２丁目,-,渋谷区初台２－１９－１６,35.677813,139.686481,さくらさくみらい　初台,認可,71,2021年10月1日時点
渋谷区,元代々木町,-,渋谷区元代々木町５１－１９,35.673310,139.686688,元代々木保育園,認可,87,2021年10月1日時点
渋谷区,富ケ谷２丁目,-,渋谷区富ヶ谷２－３０－８,35.665209,139.685072,富ヶ谷保育園,認可,94,2021年10月1日時点
渋谷区,富ケ谷１丁目,-,渋谷区富ヶ谷１－３１－３,35.666067,139.688366,富ヶ谷ちとせ保育園,認可,79,2021年10月1日時点
渋谷区,上原３丁目,-,渋谷区上原３－３７－９,35.666193,139.676283,さくらさくみらい上原,認可,77,2021年10月1日時点
渋谷区,上原２丁目,-,渋谷区上原２－４２－３,35.666445,139.681546,ポピンズナーサリースクール代々木上原,認可,90,2021年10月1日時点
渋谷区,西原１丁目,-,渋谷区西原１－４７－２,35.673855,139.684731,聖ヨゼフ保育園西原,認可,59,2021年10月1日時点
渋谷区,西原１丁目,-,渋谷区西原１－２２－２０,35.676251,139.678476,西原保育園ゆめ,認可,106,2021年10月1日時点
渋谷区,西原２丁目,-,渋谷区西原２－３３－１７,35.674632,139.676432,さくらさくみらい西原,認可,70,2021年10月1日時点
渋谷区,西原３丁目,-,渋谷区西原３－１５－１０,35.670045,139.679712,グローバルキッズ代々木上原園,認可,79,2021年10月1日時点
渋谷区,西原１丁目,-,渋谷区西原１－４０－３,35.674650,139.682489,西原ほほえみ保育園,認可,63,2021年10月1日時点
渋谷区,本町５丁目,-,渋谷区本町５－３５－１２,35.683209,139.676085,幡ヶ谷保育園,認可,92,2021年10月1日時点
渋谷区,本町１丁目,-,渋谷区本町１－５－５,35.681236,139.684236,本町第三保育園,認可,115,2021年10月1日時点
渋谷区,本町２丁目,-,渋谷区本町２－６－３　２階,35.683000,139.683376,あい・あい保育園初台本町園,認可,50,2021年10月1日時点
渋谷区,本町１丁目,-,渋谷区本町１－１９－３,35.679004,139.679671,グローバルキッズ幡ヶ谷園,認可,81,2021年10月1日時点
渋谷区,本町６丁目,-,渋谷区本町６－３４－６,35.680427,139.677854,ベネッセ幡ヶ谷保育園,認可,69,2021年10月1日時点
渋谷区,幡ケ谷３丁目,-,渋谷区幡ヶ谷３－４－１,35.679819,139.675984,幡ヶ谷第二保育園,認可,72,2021年10月1日時点
渋谷区,幡ケ谷２丁目,-,渋谷区幡ヶ谷２－５６－６,35.677887,139.671622,幡ヶ谷第三保育園,認可,73,2021年10月1日時点
渋谷区,幡ケ谷２丁目,-,渋谷区幡ヶ谷２－４２－１５,35.677877,139.674074,まなびの森保育園幡ヶ谷,認可,102,2021年10月1日時点
渋谷区,笹塚３丁目,-,渋谷区笹塚３－３６－１３,35.677212,139.665917,笹塚保育園,認可,83,2021年10月1日時点
渋谷区,笹塚１丁目,-,渋谷区笹塚１－２７－１,35.672221,139.667252,笹塚第二保育園,認可,121,2021年10月1日時点
渋谷区,笹塚２丁目,-,渋谷区笹塚２－３１－８,35.674468,139.663801,保育園うさぎとかめ,認可,123,2021年10月1日時点
渋谷区,笹塚１丁目,-,渋谷区笹塚１－３２－５,35.672500,139.666870,さくらさくみらい　笹塚,認可,80,2021年10月1日時点
渋谷区,笹塚２丁目,-,渋谷区笹塚２－３４－１２,35.675222,139.664510,笹幡保育園,認可,123,2021年10月1日時点
千代田区,九段北４丁目,-,千代田区九段北四丁目2番地22号市ヶ谷スポーツプラザ1階,35.691872,139.737221,保育園ドルチェ,認証A,40,2022年1月1日時点
千代田区,丸の内２丁目,大丸有,千代田区丸の内2-7-3,35.678597,139.764992,キッズスクウェア丸の内東京ビル,認証A,22,2022年1月1日時点
千代田区,内神田２丁目,-,千代田区内神田2-5-2,35.690120,139.767533,マミーズエンジェル神田駅前保育園,認証A,35,2022年1月1日時点
千代田区,神田神保町２丁目,-,千代田区神田神保町2-20ＳＰ神保町第2ビル1階,35.697211,139.756614,小学館アカデミー神保町保育園,認証A,40,2022年1月1日時点
千代田区,五番町,-,千代田区五番町5-6ビラカーサ五番町101号,35.689881,139.736230,ピノキオ幼児舎番町園,認証A,26,2022年1月1日時点
千代田区,永田町２丁目,赤坂,千代田区永田町2丁目1番2号衆議院第二議員会館内,35.675585,139.742797,キッズスクウェア永田町,認証A,34,2022年1月1日時点
千代田区,丸の内１丁目,大丸有,千代田区丸の内1-4-1丸の内永楽ビルディング2階,35.684451,139.764942,キッズスクウェア丸の内永楽ビル,認証A,26,2022年1月1日時点
千代田区,外神田２丁目,-,千代田区外神田2-17-4ビルデンス石村1階,35.701299,139.767580,保育室「愛の園」,認証A,30,2022年1月1日時点
千代田区,霞が関２丁目,虎ノ門広域,千代田区霞が関2-1-3,35.676193,139.751129,ナーサリールーム　ベリーベア霞が関,認証A,20,2022年1月1日時点
中央区,月島１丁目,-,中央区月島一丁目3番2号佃権月島ビル3階,35.664882,139.783811,ちゃいれっく月島駅前保育園,認証A,50,2022年1月1日時点
中央区,晴海１丁目,-,中央区晴海1-8ー16晴海トリトン2階,35.657472,139.782381,アスク晴海保育園,認証A,60,2022年1月1日時点
中央区,月島１丁目,-,中央区月島1-2-13ワイズビルディング1階,35.665651,139.783075,マミーズエンジェル月島保育園,認証A,33,2022年1月1日時点
中央区,日本橋人形町３丁目,-,中央区日本橋人形町3-4-14　KDX人形町ビル2階,35.686127,139.781346,アスク人形町駅前保育園,認証A,40,2022年1月1日時点
中央区,月島４丁目,-,中央区月島4-18-3クイーンズハウス1階,35.659541,139.782003,ピノキオ幼児舎月島園,認証A,20,2022年1月1日時点
中央区,銀座１丁目,-,中央区銀座1-25-3京橋プラザ区民館等複合施設1階,35.672998,139.771517,ポピンズナーサリースクール京橋,認証A,40,2022年1月1日時点
中央区,日本橋箱崎町,-,中央区日本橋箱崎町44-7箱崎ＹＭビル,35.681791,139.788863,グローバルキッズ水天宮前園,認証A,40,2022年1月1日時点
中央区,月島３丁目,-,中央区月島3-1-11,35.663785,139.779486,ポピンズナーサリースクール月島,認証A,30,2022年1月1日時点
中央区,新川２丁目,-,中央区新川2丁目16番10号プライムアーバン新川3Ｆ,35.675100,139.782630,グローバルキッズ新川園,認証A,40,2022年1月1日時点
中央区,月島２丁目,-,中央区月島2丁目18番2号,35.662268,139.784479,さくらさくみらい　月島,認証A,36,2022年1月1日時点
中央区,勝どき１丁目,-,中央区勝どき1-1-1プラザ勝どき1階,35.661224,139.776723,ニチイキッズさわやかプラザ勝どき保育園,認証A,60,2022年1月1日時点
中央区,日本橋浜町３丁目,-,中央区日本橋浜町3-3-1トルナーレ日本橋浜町2階,35.684671,139.787746,ニチイキッズさわやか日本橋浜町保育園,認証A,29,2022年1月1日時点
港区,芝５丁目,-,港区芝五丁目29番22号ライオンズプラザ・フェリス三田1階,35.646380,139.744639,三田プチ･クレイシュ,認証A,33,2022年1月1日時点
港区,海岸１丁目,-,港区海岸一丁目1番アクティ汐留2階,35.657246,139.757643,アスク汐留保育園,認証A,30,2022年1月1日時点
港区,三田２丁目,-,港区三田二丁目7番13号,35.651416,139.744536,ゆらりん三田保育園,認証A,20,2022年1月1日時点
港区,台場２丁目,-,港区台場2-2-3,35.630022,139.780209,アスクお台場保育園,認証A,30,2022年1月1日時点
港区,白金台３丁目,-,港区白金台三丁目15番6号2階,35.636573,139.724405,コンビプラザ白金台保育園,認証A,50,2022年1月1日時点
港区,芝浦４丁目,-,港区芝浦四丁目22番2号エアテラス2階,35.641081,139.752822,アンジェリカ保育園芝浦園,認証A,40,2022年1月1日時点
港区,芝４丁目,-,港区芝4-16-1カテリーナ三田1階,35.647494,139.750347,プチ・ナーサリー田町,認証A,40,2022年1月1日時点
港区,三田４丁目,-,港区三田4-9-7BPRレジデンス三田伊皿子坂2階,35.641395,139.737831,ポピンズナーサリースクール高輪,認証A,36,2022年1月1日時点
港区,芝浦４丁目,-,港区芝浦4-10-1キャピタルマークタワー2階,35.641098,139.746414,ポピンズナーサリースクール芝浦,認証A,34,2022年1月1日時点
港区,白金台４丁目,-,港区白金台4丁目8番16号ダリアコート白金台1階101号室,35.637508,139.724370,ポピンズナーサリースクール白金台,認証A,30,2022年1月1日時点
港区,港南２丁目,-,港区港南2丁目3番13号品川フロントビルキッズ館2F,35.629169,139.743212,アンジェリカ保育園品川園,認証A,40,2022年1月1日時点
港区,南麻布５丁目,-,港区南麻布5-1-11Ｑｉｚ広尾3階,35.655012,139.722546,ポピンズナーサリースクール広尾,認証A,33,2022年1月1日時点
港区,東麻布１丁目,-,港区東麻布1-26-2SERAPH10AZABU1・2階,35.655418,139.744803,ゆらりん東麻布保育園,認証A,47,2022年1月1日時点
港区,南麻布５丁目,-,港区南麻布5-6-8,35.653449,139.727096,ナーサリールーム,認証A,35,2022年1月1日時点
港区,赤坂１丁目,虎ノ門,港区赤坂1-8-1赤坂インターシティAIR2階,35.669981,139.742582,ポピンズナーサリースクール赤坂,認証A,30,2022年1月1日時点
港区,麻布十番１丁目,-,港区麻布十番１－１０－３　モンテプラザ２階,35.656209,139.736306,ニチイキッズさわやか白金高輪保育園,認証A,30,2022年1月1日時点
港区,白金１丁目,-,港区白金１－２５－２５,35.643783,139.731451,ニチイキッズさわやか港南保育園,認証A,73,2022年1月1日時点
港区,港南４丁目,-,港区港南４－２－５　シティタワー品川　西棟２・３階,35.631357,139.747298,ニチイキッズさわやか梅島保育園,認証A,24,2022年1月1日時点
新宿区,富久町,-,新宿区富久町13番1号ローレルコート新宿タワー2階,35.692410,139.714720,エデュケアセンター・新宿,認証A,22,2022年1月1日時点
新宿区,高田馬場２丁目,-,新宿区高田馬場2-16-11高田馬場216ビル2階,35.714446,139.705426,アスク高田馬場保育園,認証A,20,2022年1月1日時点
新宿区,改代町,-,新宿区改代町26番1号,35.707862,139.734274,ソラスト神楽坂,認証A,40,2022年1月1日時点
新宿区,西早稲田１丁目,-,新宿区西早稲田1-1-7,35.707453,139.719309,ポピンズナーサリースクール早稲田,認証A,50,2022年1月1日時点
新宿区,北新宿３丁目,-,新宿区北新宿3-2-1レグノ・セレーノ１F,35.702975,139.694670,北新宿雲母保育園,認証A,40,2022年1月1日時点
新宿区,高田馬場４丁目,-,新宿区高田馬場4丁目23番28号ヒルズISHIDA1Ｆ,35.710241,139.702063,キッズパオ高田馬場あおぞら園,認証A,28,2022年1月1日時点
新宿区,榎町,-,新宿区榎町72番地フォートリス早稲田1階,35.704896,139.728616,メリーポピンズ神楽坂ルーム,認証A,24,2022年1月1日時点
新宿区,下落合１丁目,-,新宿区下落合1丁目16番地7号,35.716078,139.695094,ぽっぽのいえほいくえん,認証A,40,2022年1月1日時点
新宿区,信濃町,-,新宿区信濃町8外苑北ＳＲＣビル2階,35.682690,139.719400,ぽけっとランド信濃町,認証A,40,2022年1月1日時点
新宿区,大久保２丁目,-,新宿区大久保2-4-1ヴィルラフィーネ東新宿1階,35.703576,139.708200,コスモス保育園,認証A,25,2022年1月1日時点
新宿区,若松町,-,新宿区若松町33-1リエール若松町1階,35.700762,139.720736,フロンティアキッズ夏目坂,認証A,21,2022年1月1日時点
江東区,大島４丁目,-,江東区大島四丁目13番21号,35.688276,139.831340,ビッキーズ保育園,認証A,58,2022年1月1日時点
江東区,豊洲５丁目,-,江東区豊洲5丁目5番1-304号,35.653835,139.796214,ゆらりん豊洲保育園,認証A,20,2022年1月1日時点
江東区,亀戸６丁目,-,江東区亀戸六丁目8番3号豊川ビル1階,35.694977,139.828057,亀戸プチ・クレイシュ,認証A,30,2022年1月1日時点
江東区,亀戸２丁目,-,江東区亀戸二丁目24番3号グランズ亀戸102,35.698458,139.823889,ゆりかごの家,認証A,21,2022年1月1日時点
江東区,新砂３丁目,-,江東区新砂3-4-35,35.666514,139.835283,マミー保育センター南砂町,認証A,26,2022年1月1日時点
江東区,東雲１丁目,-,江東区東雲1-9-22東雲キャナルコート105,35.648186,139.803402,ハイブリッドマム東雲キャナルコート,認証A,24,2022年1月1日時点
江東区,亀戸６丁目,-,江東区亀戸6丁目57番11号,35.697155,139.829736,アスク亀戸保育園,認証A,35,2022年1月1日時点
江東区,南砂２丁目,-,江東区南砂2-6-3,35.672358,139.819892,ナーサリールームベリーベアー東陽町,認証A,30,2022年1月1日時点
江東区,白河３丁目,-,江東区白河3-1-15Urbanex清澄白河1階,35.681440,139.804432,アンジェリカ保育園白河園,認証A,34,2022年1月1日時点
江東区,新砂３丁目,-,江東区新砂3-4-43,35.667538,139.833855,南砂プチ・クレイシュ,認証A,40,2022年1月1日時点
江東区,南砂６丁目,-,江東区南砂6-8-18,35.671003,139.834687,どんぐり保育園南砂,認証A,30,2022年1月1日時点
江東区,東雲１丁目,-,江東区東雲1-9-10イオン東雲ショッピングセンター内2Ｆ,35.648827,139.802114,東雲ルミナス保育園,認証A,39,2022年1月1日時点
江東区,亀戸５丁目,-,江東区亀戸5-38-31,35.698593,139.831565,ワーカーズコープ亀戸のびっこ保育園,認証A,20,2022年1月1日時点
江東区,東陽３丁目,-,江東区東陽3-27-2BINGONEビル1階,35.669892,139.815418,ハイブリッドマム東陽町,認証A,23,2022年1月1日時点
江東区,常盤２丁目,-,江東区常盤2-14-17,35.684146,139.797592,グローバルキッズ常盤園,認証A,28,2022年1月1日時点
江東区,豊洲１丁目,-,江東区豊洲1-3-1ｷｬﾅﾙﾜｰﾌﾀﾜｰｽﾞ・ｲｰｽﾄﾀﾜｰ1階,35.661851,139.794411,メリーポピンズ豊洲ルーム,認証A,40,2022年1月1日時点
江東区,石島,-,江東区石島6-7,35.680411,139.812693,文化教養学園,認証A,134,2022年1月1日時点
江東区,北砂５丁目,-,江東区北砂5丁目20番北砂5丁目団地1号棟101号室,35.684016,139.832928,ゆらりん砂町保育園,認証A,20,2022年1月1日時点
